Cites,Authors,Title,Year,Source,Publisher,ArticleURL,CitesURL,GSRank,QueryDate,Type,DOI,ISSN,CitationURL,Volume,Issue,StartPage,EndPage,ECC,CitesPerYear,CitesPerAuthor,AuthorCount,Age,Abstract,FullTextURL,RelatedURL,Author full names,Author(s) ID,Source title,Art. No.,Page start,Page end,Page count,Cited by,Link,Author Keywords,Index Keywords,Document Type,Publication Stage,Open Access,EID,Item type,Journal,Publication year,Pages,Address,Proceedings title,Conference location,Date published,ISBN,URLs,Keywords,Series
,Rossi A.; Natalini A.; Cristofori L.; Mammina M.,A tool for the data notarization with the Blockchain to ensure security and privacy,2023.0,Scopus,,,,,,,10.1109/MetroLivEnv56897.2023.10164060,,,,,,,,,,,,"This paper will describe a trustworthy blockchain-based framework to ensure secure, immutable and pseudo anonymized data collection at field level. This paper will describe the context in which the framework is being conceived and developed, starting from the analysis of the state of the art of DLT (Distributed Ledger Technology) and Blockchain, to highlight the potential uses cases in terms of data management, in particular. A specific focus will be given to the FIWARE framework, since the final objective is the creation of a tool for data gathering, as a FIWARE context broker extension. The core of the tool will be the two smart contracts implementing the PoE (Proof of Existence) and the RT-MDN (Reat Time-Monitoring Data Notarization). The smart contracts will be used for the certification of single documents and bulk of monitoring data, respectively. The second case is characterized by a periodicity of production and represent the most innovative part of the work. A first PoC (Proof of Concept) will be implemented, and first early results will be presented as well. The work is being developed in the framework of the EU co-funded 'DigiBUILD' project. © 2023 IEEE.",,,"Rossi, Alessandro (56510307500); Natalini, Andrea (58499008200); Cristofori, Lorenzo (57398363900); Mammina, Marzia (57192423009)",56510307500; 58499008200; 57398363900; 57192423009,"2023 IEEE International Workshop on Metrology for Living Environment, MetroLivEnv 2023 - Proceedings",,85.0,90.0,5.0,0.0,https://www.scopus.com/inward/record.uri?eid=2-s2.0-85165417176&doi=10.1109%2fMetroLivEnv56897.2023.10164060&partnerID=40&md5=0c0568de00a605dac049556de6818b54,Blockchain; data certification; FIWARE; notarization; Proof-of-Existence,Distributed ledger; Information management; Smart contract; Block-chain; Data certification; Data collection; Field level; Final objective; FIWARE; Notarization; Proof-of-existence; Security and privacy; State of the art; Blockchain,Conference paper,Final,,2-s2.0-85165417176,,,,,,,,,,,,
,Qi Y.; Luo Y.; Huang Y.; Li X.,Blockchain-based Privacy-Preserving Group Data Auditing with Secure User Revocation,2023.0,Scopus,,,,,,,10.32604/csse.2023.031030,,,45,1,,,,,,,,"Progress in cloud computing makes group data sharing in outsourced storage a reality. People join in group and share data with each other, making team work more convenient. This new application scenario also faces data security threats, even more complex. When a user quit its group, remaining data block signatures must be re-signed to ensure security. Some researchers noticed this problem and proposed a few works to relieve computing overhead on user side. However, considering the privacy and security need of group auditing, there still lacks a comprehensive solution to implement secure group user revocation, supporting identity privacy preserving and collusion attack resistance. Aiming at this target, we construct a concrete scheme based on ring signature and smart contracts. We introduce linkable ring signature to build a kind of novel meta data for integrity proof enabling anonymous verification. And the new meta data supports secure revocation. Meanwhile, smart contracts are using for resisting possible collusion attack and malicious re-signing computation. Under the combined effectiveness of both signature method and blockchain smart contracts, our proposal supports reliable user revocation and signature re-signing, without revealing any user identity in the whole process. Security and performance analysis compared with previous works prove that the proposed scheme is feasible and efficient. © 2023 CRL Publishing. All rights reserved.",,,"Qi, Yining (57193385635); Luo, Yubo (58258952600); Huang, Yongfeng (14627673100); Li, Xing (16679176300)",57193385635; 58258952600; 14627673100; 16679176300,Computer Systems Science and Engineering,,183.0,199.0,16.0,1.0,https://www.scopus.com/inward/record.uri?eid=2-s2.0-85136558481&doi=10.32604%2fcsse.2023.031030&partnerID=40&md5=783c0b2644ad2e3eac0a381c0c7def73,blockchain; data integrity; Provable data possession; ring signature,Authentication; Blockchain; Digital storage; Metadata; Network security; Privacy-preserving techniques; Block-chain; Cloud-computing; Collusion attack; Data auditing; Data integrity; Meta-data; Privacy preserving; Provable data possessions; Ring signatures; User revocation; Smart contract,Article,Final,All Open Access; Hybrid Gold Open Access,2-s2.0-85136558481,,,,,,,,,,,,
,Ren H.; Xu G.; Qi H.; Zhang T.,PriFR: Privacy-preserving Large-scale File Retrieval System via Blockchain for Encrypted Cloud Data,2023.0,Scopus,,,,,,,10.1109/BigDataSecurity-HPSC-IDS58521.2023.00014,,,,,,,,,,,,"As a fundamental and commonly used service, file retrieval has been extensively studied by information retrieval, cryptography, and big data communities. In this paper, we consider the problem of privacy-preserving file retrieval. A new framework named PriFR is proposed by integrating the blockchain and cloud computing infrastructures. The large-scale original files are encrypted and outsourced to the public cloud server. The encrypted retrieval indexes are stored on the full nodes in the blockchain to support traceable and unforgeable retrieval services. This design embraces the benefits brought by both cloud computing and blockchain. For the first time, PriFR decomposes the file retrieval problem into the numerical query and keyword search on the file metadata. In doing so, each file can be characterized more precisely than the traditional keyword search based schemes. In addition to functionality, PriFR only applies fast and lightweight symmetric cryptographical primitives to reach near plaintext retrieval efficiency. In specific, the numerical query is implemented atop order-preserving encryption (OPE) that is perfectly compatible with plaintext indexing techniques. The price for such high efficiency is its vulnerability to inference attacks. Given enough background knowledge, the plaintext can be recovered with high probability. To resist this attack, PriFR injects differential privacy noises into the raw data to offer guaranteed privacy-preserving strength with a negligible extra efficiency cost. The experimental results have demonstrated the effectiveness of PriFR.  © 2023 IEEE.",,,"Ren, Hao (57188835251); Xu, Guowen (57189258305); Qi, Han (58314074000); Zhang, Tianwei (55635885400)",57188835251; 57189258305; 58314074000; 55635885400,"Proceedings - 2023 IEEE 9th International Conference on Big Data Security on Cloud, IEEE International Conference on High Performance and Smart Computing, and IEEE International Conference on Intelligent Data and Security, BigDataSecurity-HPSC-IDS 2023",,16.0,23.0,7.0,1.0,https://www.scopus.com/inward/record.uri?eid=2-s2.0-85161800663&doi=10.1109%2fBigDataSecurity-HPSC-IDS58521.2023.00014&partnerID=40&md5=6778e4dcd86d66e036d271e489592859,big data; Blockchain; cloud computing; private query; searchable encryption,Big data; Cloud computing; Efficiency; Privacy-preserving techniques; Search engines; Block-chain; Cloud-computing; Files retrieval; Keyword search; Large-scales; Plaintext; Privacy preserving; Private query; Retrieval systems; Searchable encryptions; Blockchain,Conference paper,Final,,2-s2.0-85161800663,,,,,,,,,,,,
,Li W.; Chen Y.; Gao F.; Zhang S.; Zhang H.; Wen Q.,Privacy Protection Data Retrieval Scheme With Inverted Index for IoT Based on Blockchain,2023.0,Scopus,,,,,,,10.1109/JIOT.2021.3128528,,,10,14,,,,,,,,"In the 6G era, Internet of Things (IoT) devices can form a blockchain network, which also faces the problems of data sharing. The data transmitted and stored through the network have the risk of privacy leaking. Encrypting the shared data can satisfy the need of the privacy, and retrieving the encrypted data can make the data used efficiently. However, to enable users to retrieve encrypted data and perform fine-grained authorization on their encrypted files is still a great challenge. Although attribute-based keyword search (ABKS) is a well-received solution to the challenge, there are still privacy and efficiency issues if the traditional ABKS schemes are directly used in blockchain data sharing. In order to solve the problems, this article proposes privacy protection data retrieval scheme with an inverted index, which is an application of attribute-based encryption. First, our scheme is proved secure against the outside keyword guessing attack (KGA) and chosen keyword attack (CKA) under the semitrusted model. Second, the scheme returns a multikeywords ranked result. Third, we analyze the efficiency of our scheme and verify it by simulation. The results show that our scheme has improvement in efficiency and can meet the data sharing needs of the blockchain network composed of IoT devices. © 2014 IEEE.",,,"Li, Wenmin (27170357500); Chen, Yang (55966677000); Gao, Fei (55621493300); Zhang, Shuo (57224898227); Zhang, Hua (36656785600); Wen, Qiaoyan (7006468768)",27170357500; 55966677000; 55621493300; 57224898227; 36656785600; 7006468768,IEEE Internet of Things Journal,,12090.0,12101.0,11.0,2.0,https://www.scopus.com/inward/record.uri?eid=2-s2.0-85130468722&doi=10.1109%2fJIOT.2021.3128528&partnerID=40&md5=cc079f2a490fe18ee27dcc67d667a6e2,Blockchain; Internet of Things (IoT); inverted index; multikeyword ranked search; privacy protection,Authorization; Blockchain; Cryptography; Efficiency; Indexing (of information); Internet of things; Search engines; Block-chain; Data retrieval; Data Sharing; Index; Inverted indices; Multi keywords; Multi-keyword ranked search; Privacy protection; Resist; Data privacy,Article,Final,,2-s2.0-85130468722,,,,,,,,,,,,
,Huang Y.; Yu Y.; Li H.; Li Y.; Tian A.,Blockchain-based continuous data integrity checking protocol with zero-knowledge privacy protection,2022.0,Scopus,,,,,,,10.1016/j.dcan.2022.04.017,,,8,5,,,,,,,,"The cloud computing technology has emerged, developed, and matured in recent years, consequently commercializing remote outsourcing storage services. An increasing number of companies and individuals have chosen the cloud to store their data. However, accidents, such as cloud server downtime, cloud data loss, and accidental deletion, are serious issues for some applications that need to run around the clock. For some mission and business-critical applications, the continuous availability of outsourcing storage services is also necessary to protect users' outsourced data during downtime. Nevertheless, ensuring the continuous availability of data in public cloud data integrity auditing protocols leads to data privacy issues because auditors can obtain the data content of users by a sufficient number of storage proofs. Therefore, protecting data privacy is a burning issue. In addition, existing data integrity auditing schemes that rely on semi-trusted third-party auditors have several security problems, including single points of failure and performance bottlenecks. To deal with these issues, we propose herein a blockchain-based continuous data integrity checking protocol with zero-knowledge privacy protection. We realize a concrete construction by using a verifiable delay function with high efficiency and proof of retrievability, and prove the security of the proposal in a random oracle model. The proposed construction supports dynamic updates for the outsourced data. We also design smart contracts to ensure fairness among the parties involved. Finally, we implement the protocols, and the experimental results demonstrate the efficiency of the proposed protocol. © 2022 Chongqing University of Posts and Telecommunications",,,"Huang, Yiting (57893662700); Yu, Yong (57752708000); Li, Huilin (57211504434); Li, Yannan (55961810800); Tian, Aikui (8612601700)",57893662700; 57752708000; 57211504434; 55961810800; 8612601700,Digital Communications and Networks,,604.0,613.0,9.0,5.0,https://www.scopus.com/inward/record.uri?eid=2-s2.0-85138203409&doi=10.1016%2fj.dcan.2022.04.017&partnerID=40&md5=d240eaff905fcc34de589371d29dab69,Blockchain; Continuous availability; Verifiable delay function; Zero-knowledge privacy,,Article,Final,All Open Access; Gold Open Access,2-s2.0-85138203409,,,,,,,,,,,,
,Xu G.; Qi C.; Dong W.; Gong L.; Liu S.; Chen S.; Liu J.; Zheng X.,A Privacy-Preserving Medical Data Sharing Scheme Based on Blockchain,2023.0,Scopus,,,,,,,10.1109/JBHI.2022.3203577,,,27,2,,,,,,,,"With the increasing penetration of the Internet of things (IoT) into people's lives, the limitations of traditional medical systems are emerging. First, the typical way of handling sensitive information can easily lead to privacy disclosure. Second, the medical system is relatively isolated. It is difficult for one medical system to share data with another, and the scope of users' activities is limited within the system boundary. To solve these two problems, we propose a new privacy-preserving medical data-sharing scheme by introducing the authorization mechanism and attribute-based encryption (ABE) based on blockchain, which breaks system boundaries and realizes data sharing among several medical institutions. ABE is used to realize scalable access control. In addition, doctors can share their knowledge to diagnose users by introducing many-to-many matching, which means that patients' health data can be represented by multiple keywords and doctors' expertise can be represented by multiple interests. We provide the correctness and security analysis of our scheme and implement a prototype tool on Ethereum. The experimental results show that our scheme solves the contradiction between the privacy preservation of medical data and the necessity of data sharing.  © 2022 IEEE.",,,"Xu, Guangquan (22981884000); Qi, Chen (57888227600); Dong, Wenyu (57888001100); Gong, Lixiao (57455768600); Liu, Shaoying (35243051900); Chen, Si (57192605113); Liu, Jian (55898029600); Zheng, Xi (57222996905)",22981884000; 57888227600; 57888001100; 57455768600; 35243051900; 57192605113; 55898029600; 57222996905,IEEE Journal of Biomedical and Health Informatics,,698.0,709.0,11.0,7.0,https://www.scopus.com/inward/record.uri?eid=2-s2.0-85137924872&doi=10.1109%2fJBHI.2022.3203577&partnerID=40&md5=06b19d22a40503667aa09b4e2e782165,Attribute-based encryption; blockchain; intelligent medical system; privacy preserving,Blockchain; Computer Security; Confidentiality; Humans; Information Dissemination; Privacy; Authorization; Blockchain; Internet of things; Medical imaging; Medical problems; Privacy-preserving techniques; Sensitive data; Attribute-based encryptions; Block-chain; Data Sharing; Intelligent medical system; Medical diagnostic imaging; Medical services; Medical systems; Privacy; Privacy preserving; adult; article; authorization; blockchain; data privacy; diagnostic imaging; encryption; health data; human; internet of things; medical service; privacy; computer security; confidentiality; information dissemination; Diagnosis,Article,Final,,2-s2.0-85137924872,,,,,,,,,,,,
,Islam M.S.; Ameedeen M.A.B.; Ajra H.; Ismail Z.B.,Blockchain-enabled Secure Privacy-preserving System for Public Health-center Data,2023.0,Scopus,,,,,,,10.14569/IJACSA.2023.01405118,,,14,5,,,,,,,,"Health center data implicates a large scale of individual health records and is immensely concealment sensory. In the virtual era of large-size data, the increasingly different health informatization causes it important that health data needs to be stored precisely and securely. However, daily health data transactions carry the risk of privacy leaks that make sharing dif-ficult. Moreover, the recently permitted blockchain applications suffer from deficient performance and lack of privacy. This study presents a privacy-preserving and secure sharing and storage system for public health centers based on the blockchain method to dispose of these issues. This system utilizes a hash-256-based access controller and transaction signature with the consensus policy and provides security to share and store health data in the blockchain. In this approach, blockchain guarantees scalability, privacy, integrity, and availability for data retention. Also, this paper measures the performance of transactions with supporting confidentiality-preserving and shows the average transaction time and acceptable latency when accessing health data. © (2023), All Rights Reserved.",,,"Islam, Md. Shohidul (57225862368); Ameedeen, Mohamed Ariff Bin (25654017200); Ajra, Husnul (57222260178); Ismail, Zahian Binti (35174754700)",57225862368; 25654017200; 57222260178; 35174754700,International Journal of Advanced Computer Science and Applications,,1147.0,1154.0,7.0,0.0,https://www.scopus.com/inward/record.uri?eid=2-s2.0-85161353959&doi=10.14569%2fIJACSA.2023.01405118&partnerID=40&md5=afa391b367dd600dc4057d5c36715a09,Blockchain; data; health; public; secure transaction,Digital storage; Health risks; Privacy-preserving techniques; Public health; Block-chain; Data; Health centers; Health data; Health records; Large-scales; Performance; Privacy preserving; Public; Secure transactions; Blockchain,Article,Final,All Open Access; Gold Open Access,2-s2.0-85161353959,,,,,,,,,,,,
,de Moraes Rossetto A.G.; Sega C.; Leithardt V.R.Q.,An Architecture for Managing Data Privacy in Healthcare with Blockchain,2022.0,Scopus,,,,,,,10.3390/s22218292,,,22,21,,,,,,,,"With the fast development of blockchain technology in the latest years, its application in scenarios that require privacy, such as health area, have become encouraged and widely discussed. This paper presents an architecture to ensure the privacy of health-related data, which are stored and shared within a blockchain network in a decentralized manner, through the use of encryption with the RSA, ECC, and AES algorithms. Evaluation tests were performed to verify the impact of cryptography on the proposed architecture in terms of computational effort, memory usage, and execution time. The results demonstrate an impact mainly on the execution time and on the increase in the computational effort for sending data to the blockchain, which is justifiable considering the privacy and security provided with the architecture and encryption. © 2022 by the authors.",,,"de Moraes Rossetto, Anubis Graciela (23398713000); Sega, Christofer (57817325600); Leithardt, Valderi Reis Quietinho (57826453900)",23398713000; 57817325600; 57826453900,Sensors,8292,,,,13.0,https://www.scopus.com/inward/record.uri?eid=2-s2.0-85141553966&doi=10.3390%2fs22218292&partnerID=40&md5=4226f85539fa491de3c0beb5960bc260,blockchain; cryptography; DApp; health data; privacy,Algorithms; Blockchain; Computer Security; Delivery of Health Care; Privacy; Technology; Blockchain; Data privacy; Health; Network architecture; AES algorithms; Block-chain; Computational effort; Dapp; Decentralised; ECC algorithms; Health data; ITS applications; Privacy; RSA algorithms; algorithm; computer security; health care delivery; privacy; technology; Cryptography,Article,Final,All Open Access; Gold Open Access; Green Open Access,2-s2.0-85141553966,,,,,,,,,,,,
,Llanos J.T.; Carr M.; Rana O.,Using the blockchain to enable transparent and auditable processing of personal data in cloud- based services: Lessons from the Privacy-Aware Cloud Ecosystems (PACE) project,2023.0,Scopus,,,,,,,10.1016/j.clsr.2023.105873,,,51,,,,,,,,,"The architecture of cloud-based services is typically opaque and intricate. As a result, data subjects cannot exercise adequate control over their personal data, and overwhelmed data protection authorities must spend their limited resources in costly forensic efforts to ascertain instances of non-compliance. To address these data protection challenges, a group of computer scientists and socio-legal scholars joined forces in the Privacy-Aware Cloud Ecosystems (PACE) project to design a blockchain-based privacy-enhancing technology (PET). This article presents the fruits of this collaboration, highlighting the capabilities and limits of our PET, as well as the challenges we encountered during our interdisciplinary endeavour. In particular, we explore the barriers to interdisciplinary collaboration between law and computer science that we faced, and how these two fields’ different expectations as to what technology can do for data protection law compliance had an impact on the project's development and outcome. We also explore the overstated promises of techno-regulation, and the practical and legal challenges that militate against the implementation of our PET: most industry players have no incentive to deploy it, the transaction costs of running it make it prohibitively expensive, and there are significant clashes between the blockchain's decentralised architecture and GDPR's requirements that hinder its deployability. We share the insights and lessons we learned from our efforts to overcome these challenges, hoping to inform other interdisciplinary projects that are increasingly important to shape a data ecosystem that promotes the protection of our personal data. © 2023 The Authors",,,"Llanos, Jose Tomas (57210473448); Carr, Madeline (55859713100); Rana, Omer (7003659610)",57210473448; 55859713100; 7003659610,Computer Law and Security Review,105873,,,,0.0,https://www.scopus.com/inward/record.uri?eid=2-s2.0-85174463994&doi=10.1016%2fj.clsr.2023.105873&partnerID=40&md5=e820b394aa00ce3a0a6baa61a0907221,"Blockchain, PET; Data protection; Data protection-by-design; GDPR; Privacy","Compliance control; Costs; Data privacy; Ecosystems; Block-chain; Blockchain, privacy-enhancing technology; Cloud-based; Data protection by designs; Data subjects; GDPR; Non-compliance; Privacy; Privacy aware; Privacy enhancing technologies; Blockchain",Article,Final,All Open Access; Hybrid Gold Open Access,2-s2.0-85174463994,,,,,,,,,,,,
,Yu J.; Han Y.; Zhang K.; Chen S.; Li J.,Blockchain-Based Privacy-Preserving Sensor Data Sharing with Fine-Grained Authorization in Microgrid,2023.0,Scopus,,,,,,,10.1155/2023/9621839,,,2023,,,,,,,,,"Microgrid is a power system that includes various energy sources (e.g., solar panels and wind turbines), where a number of device status and sensing data are collected and transmitted by smart sensors. Based on sensing-as-a-service in microgrid, sensor owners and sensor data consumers can effectively perform data sharing operations. However, the state-of-the-art sensor data sharing works in microgrid have the following two limitations: (i) cannot support fine-grained authorization for sensor owners and sensor data consumers and (ii) fail to simultaneously consider confidentiality and authenticity for sensor data sharing. To address the problems, in this article, we propose a lightweight privacy-preserving sensing data sharing system with fine-grained authorization in microgrid. Technically, we employed attribute-based signature methodology to design a fined-grained authorization mechanism for sensor data users. Moreover, a lightweight hyper elliptic curve-based signcryption scheme is employed to provide confidentiality and authenticity for sensor data sharing. To clarify the feasibility of our proposed system, we implement the system and evaluate the performance. The experimental results show that the system achieves small communication and time overhead, as well as highly acceptable gas consumption of smart contract.  © 2023 Jinhu Yu et al.",,,"Yu, Jinhu (57225115805); Han, Yue (58290216300); Zhang, Kai (56896474200); Chen, Siyuan (57193604362); Li, Jinguo (39761989800)",57225115805; 58290216300; 56896474200; 57193604362; 39761989800,Security and Communication Networks,9621839,,,,0.0,https://www.scopus.com/inward/record.uri?eid=2-s2.0-85160286414&doi=10.1155%2f2023%2f9621839&partnerID=40&md5=9eff9d075f3806a062ab55a6e8d97587,,Authentication; Blockchain; Data Sharing; Privacy-preserving techniques; Block-chain; Data Sharing; Energy source; Fine grained; Microgrid; Power; Privacy preserving; Sensing data; Sensors data; Solar/wind; Authorization,Article,Final,All Open Access; Gold Open Access,2-s2.0-85160286414,,,,,,,,,,,,
