Cites,Authors,Title,Year,Source,Publisher,ArticleURL,CitesURL,GSRank,QueryDate,Type,DOI,ISSN,CitationURL,Volume,Issue,StartPage,EndPage,ECC,CitesPerYear,CitesPerAuthor,AuthorCount,Age,Abstract,FullTextURL,RelatedURL,Author full names,Author(s) ID,Source title,Art. No.,Page start,Page end,Page count,Cited by,Link,Author Keywords,Index Keywords,Document Type,Publication Stage,Open Access,EID,Item type,Journal,Publication year,Pages,Address,Proceedings title,Conference location,Date published,ISBN,URLs,Keywords,Series
,Liu J.; He X.; Sun R.; Du X.; Guizani M.,Privacy-Preserving Data Sharing Scheme with FL via MPC in Financial Permissioned Blockchain,2021.0,Scopus,,,,,,,10.1109/ICC42927.2021.9500868,,,,,,,,,,,,"Each bank has different clients and each client may have transactions with multiple banks. Hence, clients' data in a single bank may be partial and incomplete. If the data can be combined, each bank obtains comprehensive information, so as to better carry out business and enhance the quality of service, such as recommending financial products and inquiring about personal credit records. However, after the promulgation of GDPR by European Union in 2018, it is illegal to directly consolidate data crossing enterprises due to privacy and security concerns, especially for privacy-sensitive industries. Emerging federated learning(FL) is very suitable for secure data sharing for distributed banks in privacy. To prevent from connection of clients' data and the certain bank, we adopt anonymity mechanism to hide the real identity of banks. In this paper, we first propose blockchain-empowered secure federated learning for distributed banks based on multi-party computation(MPC) with multi-key fully-homomorphic encryption(FHE) scheme. Then, we give detailed description of multi-key FHE based MPC protocol, anonymity mechanism and permissioned blockchain consensus protocol. Finally, we analyze the security and compare our scheme with several existed schemes. Numerical results show that the proposed data sharing scheme has good performance in terms of computational overhead and model accuracy. © 2021 IEEE.",,,"Liu, Jingwei (8555212500); He, Xinyu (57271079600); Sun, Rong (22936009700); Du, Xiaojiang (8371278000); Guizani, Mohsen (7004750176)",8555212500; 57271079600; 22936009700; 8371278000; 7004750176,IEEE International Conference on Communications,,,,,8.0,https://www.scopus.com/inward/record.uri?eid=2-s2.0-85115687551&doi=10.1109%2fICC42927.2021.9500868&partnerID=40&md5=b52041fdbcf4faa09bdeb1c10ee2d0fd,,Cryptography; Data privacy; Data Sharing; Quality of service; Anonymity mechanism; Block-chain; Comprehensive information; Data Sharing; Financial products; Multiparty computation; Personal credit; Privacy preserving; Quality-of-service; Sharing schemes; Blockchain,Conference paper,Final,,2-s2.0-85115687551,,,,,,,,,,,,
,Wang Y.-J.; Cao C.-T.; You L.,A novel personal privacy data protection scheme based on blockchain and attribute-based encryption; [基于区块链和属性基加密的个人隐私数据保护方案],2021.0,Scopus,,,,,,,10.13868/j.cnki.jcr.000416,,,8,1,,,,,,,,"A personal privacy data protection scheme based on attribute-based encryption and blockchain is proposed, which solves the problem of privacy leakage when users use services provided by third-party applications. The scheme saves the hash value of personal privacy data and the attribute sets of third-party applications on blockchain, while the real privacy information is encrypted using an attribute-based algorithm, the ciphertext is stored in a distributed hash table. The scheme implements one-to-many secure transmission of personal data and fine-grained access control of data. For users' needs change dynamically in different periods, this paper proposes a new attribute-based encryption scheme. In the proposed scheme, users can revoke access from third-party applications at any time without needing the assistance of a trusted third party. Simulation experiments were carried out to verify the feasibility and practicability of the scheme. © 2021 The Authors",,,"Wang, Yu-Jiang (57226131913); Cao, Cheng-Tang (57222657950); You, Lin (36344208500)",57226131913; 57222657950; 36344208500,Journal of Cryptologic Research,,14.0,27.0,13.0,11.0,https://www.scopus.com/inward/record.uri?eid=2-s2.0-85110506257&doi=10.13868%2fj.cnki.jcr.000416&partnerID=40&md5=e9b63e72f56f660d727ff327598253b0,Attribute-based encryption; Blockchain; Distributed hash table; Privacy data,,Article,Final,,2-s2.0-85110506257,,,,,,,,,,,,
,Hu B.; Li Y.; Fang F.; Shang X.,Lightweight-blockchain based privacy-preserving data aggregation for epidemic disease surveillance; [基于轻量级区块链的隐私保护传染病监测数据聚合],2021.0,Scopus,,,,,,,10.1360/SSI-2021-0002,,,51,11,,,,,,,,"As the COVID-19 pandemic is raging worldwide, epidemic surveillance helps prevent the spread of the epidemic. Protecting the privacy of patients and data providers in the monitoring system can relieve them of their concerns about the leakage of private information, thereby improving the epidemic data collection capabilities of the system. In this article, we propose a lightweight-blockchain based privacy-preserving data aggregation scheme (LBPDA) for epidemic disease surveillance, which can aggregate data without relying on a trusted third party. Especially, to protect data privacy in the data aggregation process, the case count data is aggregated based on the Paillier cryptosystem's homomorphism. Besides, to reduce the time and storage overhead, we improved the adopted Hyperledger Fabric, thus lightening the data aggregation process. Finally, we simulated the proposed scheme and analyzed its security and performance to verify its feasibility and effectiveness. The results showed that the proposed scheme could meet the government department's requirements to aggregate patient case count data for epidemic disease surveillance while protecting the privacy of patients and data providers. Moreover, we also proved that the lightweight of blockchain is effective by comparison. © 2021, Science China Press. All right reserved.",,,"Hu, Baiji (57216634211); Li, Yuancheng (56436141600); Fang, Fang (55624485445); Shang, Xingyu (57349127900)",57216634211; 56436141600; 55624485445; 57349127900,Scientia Sinica Informationis,,1885.0,1899.0,14.0,0.0,https://www.scopus.com/inward/record.uri?eid=2-s2.0-85119603405&doi=10.1360%2fSSI-2021-0002&partnerID=40&md5=aa448565202febff8db2a02d78c7430e,Blockchain; Epidemic disease surveillance; Hyperledger Fabric; Paillier cryptosystem; Privacy-preserving data aggregation,,Article,Final,,2-s2.0-85119603405,,,,,,,,,,,,
,Silva W.; Garcia A.C.B.,Where is our data? A Blockchain-based Information Chain of Custody Model for Privacy Improvement,2021.0,Scopus,,,,,,,10.1109/CSCWD49262.2021.9437727,,,,,,,,,,,,"The advancement of Information and Communication Technologies has brought numerous facilities and benefits to society. In this environment, surrounded by technologies, data, and personal information, have become an essential and coveted tool for many sectors. In this scenario, where a large amount of data has been collected, stored, and shared, privacy concerns arise, especially when dealing with sensitive data such as health data. The information owner generally has no control over his information, which can bring serious consequences such as increases in health insurance prices or put the individual in an uncomfortable situation with disclosing his physical or mental health. While privacy regulations, like the General Data Protection Regulation (GDPR), make it clear that the information owner must have full control and management over their data, disparities have been observed in most systems and platforms. Therefore, they are often not able to give consent or have control and management over their data. For the users to exercise their right to privacy and have sufficient control over their data, they must know everything that happens to them, where their data is, and where they have been. It is necessary that the entire life cycle, from generation to deletion of data, is managed by its owner. To this end, this article presents an Information Chain of Custody Model based on Blockchain technology, which allows from the traceability of information to the offer of tools that will enable the effective management of data, offering total control to its owner. The result showed that the prototype was very useful in the traceability of the information. With that it became clear the technical feasibility of this research. © 2021 IEEE.",,,"Silva, Wagner (57224869792); Garcia, Ana Cristina Bicharra (25723096500)",57224869792; 25723096500,"Proceedings of the 2021 IEEE 24th International Conference on Computer Supported Cooperative Work in Design, CSCWD 2021",9437727,329.0,334.0,5.0,5.0,https://www.scopus.com/inward/record.uri?eid=2-s2.0-85107748090&doi=10.1109%2fCSCWD49262.2021.9437727&partnerID=40&md5=8aacf2dcd44fe9176d4d2f9afcc2224e,blockchain; chain of custody; health data; information management; privacy; sensitive data; traceability,Blockchain; Health; Health insurance; Interactive computer systems; Life cycle; Privacy by design; Control and management; Effective management; Entire life cycles; General data protection regulations; Information and Communication Technologies; Personal information; Privacy regulation; Right to privacies; Information management,Conference paper,Final,,2-s2.0-85107748090,,,,,,,,,,,,
,Hong Y.; Zhao X.; Zhu H.; Li H.,A Blockchain-Integrated Divided-Block Sparse Matrix Transformation Differential Privacy Data Publishing Model,2021.0,Scopus,,,,,,,10.1155/2021/2418539,,,2021,,,,,,,,,"With the rapid development of information technology, people benefit more and more from big data. At the same time, it becomes a great concern that how to obtain optimal outputs from big data publishing and sharing management while protecting privacy. Many researchers seek to realize differential privacy protection in massive high-dimensional datasets using the method of principal component analysis. However, these algorithms are inefficient in processing and do not take into account the different privacy protection needs of each attribute in high-dimensional datasets. To address the above problem, we design a Divided-block Sparse Matrix Transformation Differential Privacy Data Publishing Algorithm (DSMT-DP). In this algorithm, different levels of privacy budget parameters are assigned to different attributes according to the required privacy protection level of each attribute, taking into account the privacy protection needs of different levels of attributes. Meanwhile, the use of the divided-block scheme and the sparse matrix transformation scheme can improve the computational efficiency of the principal component analysis method for handling large amounts of high-dimensional sensitive data, and we demonstrate that the proposed algorithm satisfies differential privacy. Our experimental results show that the mean square error of the proposed algorithm is smaller than the traditional differential privacy algorithm with the same privacy parameters, and the computational efficiency can be improved. Further, we combine this algorithm with blockchain and propose an Efficient Privacy Data Publishing and Sharing Model based on the blockchain. Publishing and sharing private data on this model not only resist strong background knowledge attacks from adversaries outside the system but also prevent stealing and tampering of data by not-completely-honest participants inside the system.  © 2021 Yiyang Hong et al.",,,"Hong, Yiyang (57396421200); Zhao, Xingwen (36661700200); Zhu, Hui (55717897100); Li, Hui (57218312611)",57396421200; 36661700200; 55717897100; 57218312611,Security and Communication Networks,2418539,,,,0.0,https://www.scopus.com/inward/record.uri?eid=2-s2.0-85122259631&doi=10.1155%2f2021%2f2418539&partnerID=40&md5=56838ee81b09095ddae2f6b98315b1a9,,Blockchain; Data privacy; Efficiency; Large dataset; Linear transformations; Matrix algebra; Mean square error; Metadata; Parameter estimation; Principal component analysis; Block sparse; Block-chain; Data publishing; Data Sharing; Differential privacies; High-dimensional dataset; Matrix transformation; Principal-component analysis; Privacy protection; Sparse matrices; Computational efficiency,Article,Final,All Open Access; Gold Open Access,2-s2.0-85122259631,,,,,,,,,,,,
,Hossain M.J.; Wadud M.A.H.; Alamin M.,HDM-Chain: A Secure Blockchain-based Healthcare Data Management framework to ensure Privacy and Security in the Health Unit,2021.0,Scopus,,,,,,,10.1109/ICEEICT53905.2021.9667820,,,,,,,,,,,,"In conventional medical data monitoring systems are suffering key challenges in phases of information immutability, traceability, transparency, observation, data validation, access permission, reliability, privacy, and safety. Personal Health Records(PHR) have various advantages globally, but at PHRs data is ruled to essential safety and privacy concerns. This paper suggests a method to implement a reliable clarification to these points. Traditionally sophisticated methods trading with the security of health records ordinarily makes information inaccessible system to patients. Certain methods struggle to adjust information reliability, patient desire, and regular communication with supplier information. Blockchain(BC) resolves the preceding difficulties from it shares data in a decentralized and transactional way. The utilize of BC could support the healthcare division to adjust the accessibility, privacy, and security of PHRs. This document suggests a BC framework to efficiently and securely collect and keep health records. It represents a reliable and skilled means of achieving healthcare data for patients, physicians, and security insurance agencies while defending the patients of information. The goal of this activity is to show how the suggested system fits the safety requirements of participants (patients), physicians, and third performances and discusses privacy and safety attention in the medical division. © 2021 IEEE.",,,"Hossain, Md. Jobaer (57438828000); Wadud, Md. Anwar Hussen (57223046517); Alamin, Md. (57192643193)",57438828000; 57223046517; 57192643193,"2021 5th International Conference on Electrical Engineering and Information and Communication Technology, ICEEICT 2021",,,,,5.0,https://www.scopus.com/inward/record.uri?eid=2-s2.0-85123531676&doi=10.1109%2fICEEICT53905.2021.9667820&partnerID=40&md5=a4dba05e1ad12c82e218a49d5935dc23,Access Control; Blockchain; Data Monitoring; Online Medical Record; Patient Record; Privacy; Security,Access control; Data privacy; Health care; Information management; Medical information systems; Security systems; Block-chain; Data monitoring; Health records; Management frameworks; Medical record; Online medical record; Patient record; Privacy; Privacy and security; Security; Blockchain,Conference paper,Final,,2-s2.0-85123531676,,,,,,,,,,,,
,Zhu L.; Peng S.; Cai Z.; Liu W.; He C.; Tang W.,Research on Privacy Data Protection Based on Trusted Computing and Blockchain,2021.0,Scopus,,,,,,,10.1155/2021/6274860,,,2021,,,,,,,,,"Aiming at the problems of low protection accuracy and long time consumption in traditional privacy data protection methods, a privacy data protection method based on trusted computing and blockchain is proposed. Set up the Internet node secure transmission protocol through the trusted node uplink transmission protocol and the downlink transmission protocol, and according to the transmission protocol, combined with the blockchain technology, the ECC elliptic curve encryption algorithm is used to encrypt the amount of data existing in the blockchain, and the AES symmetric encryption algorithm is used to encrypt the private data that exists in the nonblockchain, thereby completing the protection of network private data. The simulation experiment results show that the privacy data protection accuracy of the proposed method is higher and the work efficiency is faster.  © 2021 Linkai Zhu et al.",,,"Zhu, Linkai (57224120847); Peng, Sheng (57226270072); Cai, Zhiming (36873968200); Liu, Wenjian (57215504683); He, Chunjiang (57226285656); Tang, Weikang (57226290123)",57224120847; 57226270072; 36873968200; 57215504683; 57226285656; 57226290123,Security and Communication Networks,6274860,,,,2.0,https://www.scopus.com/inward/record.uri?eid=2-s2.0-85122539801&doi=10.1155%2f2021%2f6274860&partnerID=40&md5=4c408716f6cae60b108ecf76e21b304d,,Cryptography; Data privacy; Network security; Trusted computing; Block-chain; Downlink transmissions; Elliptic curves encryption algorithm; Internet nodes; Private data; Protection methods; Secure transmission; Time consumption; Transmission protocols; Uplink transmission; Blockchain,Article,Final,All Open Access; Gold Open Access,2-s2.0-85122539801,,,,,,,,,,,,
,Sathiyabhama B.; Rajeswari K.C.; Reenadevi R.; Arul Murugan R.,Preserving Data Privacy in Electronic Health Records Using Blockchain Technology,2021.0,Scopus,,,,,,,10.4018/978-1-7998-8954-0.ch057,,,,,,,,,,,,"Technology is a boon to mankind in this fast-growing era. The advancement in technology is the predominant factor for the sophisticated way of living of the people. In spite of technology, revolution happens across the world, and mankind still suffers due to various health issues. Healthcare industries take immense measures to improve the quality of life. An enormous volume of digital data is being handled every day in the healthcare industry. There arises a need for the intervention of technology in the healthcare industry to be taken to a greater extent. The prime duty of any healthcare industry is to store and maintain those data in the form of electronic health records (EHR) in a secured manner. © 2021, IGI Global.",,,"Sathiyabhama, B. (15120039000); Rajeswari, K.C. (57212629738); Reenadevi, R. (57211803431); Arul Murugan, R. (57819343300)",15120039000; 57212629738; 57211803431; 57819343300,Research Anthology on Privatizing and Securing Data,,1222.0,1230.0,8.0,0.0,https://www.scopus.com/inward/record.uri?eid=2-s2.0-85134902170&doi=10.4018%2f978-1-7998-8954-0.ch057&partnerID=40&md5=b2785d4458ba2b70dd238f230851baf8,,,Book chapter,Final,,2-s2.0-85134902170,,,,,,,,,,,,
,Lu W.; Ren Z.; Xu J.; Chen S.,Edge Blockchain Assisted Lightweight Privacy-Preserving Data Aggregation for Smart Grid,2021.0,Scopus,,,,,,,10.1109/TNSM.2020.3048822,,,18,2,,,,,,,,"Compared with traditional power systems, smart grid is designed to provide effective and secure energy services. Data aggregation is one of the key technologies in wireless sensor networks, which reduces the amount of data transmission between nodes by merging similar data and simplifying redundant data, thus significantly reducing the computation cost and communication overhead of the system. Many data aggregation schemes have been developed for the smart grid in the past years. However, most of the data aggregation schemes ignore the data security and privacy protection issues of the edge layer. To solve these problems, in this article, we propose an edge blockchain assisted lightweight privacy-preserving data aggregation for smart grid, named EBDA. In this work, we integrate edge computing and blockchain to design a three-layer architecture data aggregation scheme for smart grid. This new architecture supports a two-level data aggregation scheme, which is more efficient and secure. Through theoretical analysis and simulations, EBDA shows great superiority in terms of resisting network attacks, reducing system computation costs and communication overhead compared with existing schemes.  © 2004-2012 IEEE.",,,"Lu, Weifeng (57203010328); Ren, Zhihao (57221419803); Xu, Jia (55506790200); Chen, Siguang (35728449100)",57203010328; 57221419803; 55506790200; 35728449100,IEEE Transactions on Network and Service Management,9312167,1246.0,1259.0,13.0,45.0,https://www.scopus.com/inward/record.uri?eid=2-s2.0-85099080580&doi=10.1109%2fTNSM.2020.3048822&partnerID=40&md5=2c080a2d97c9fb1529df8df77cd86b27,blockchain; data aggregation; Edge computing; smart grid,Blockchain; Cost benefit analysis; Cost reduction; Electric power transmission networks; Network architecture; Privacy by design; Sensor nodes; Analysis and simulation; Communication overheads; Computation costs; Data security and privacy; Privacy preserving; Reducing systems; Threelayer architecture; Traditional power system; Smart power grids,Article,Final,,2-s2.0-85099080580,,,,,,,,,,,,
,Wang Z.; Lin S.; Zhang M.; Nie S.,Research on the control of user privacy data disclosure based on blockchain Technology,2021.0,Scopus,,,,,,,10.1109/ICSGEA53208.2021.00103,,,,,,,,,,,,"Traditional control methods always have the problems of inaccurate and time-consuming control of user privacy data leakage. This paper proposes a method of user privacy data leakage control based on blockchain technology. Firstly, the asymmetric encryption algorithm in blockchain technology is selected as the basis, combined with formula bayes to calculate the conditional probability distribution, and judge the type of user privacy data. In the case of following the discrimination method of RSS, the problem of user data privacy is solved, the data security is controlled, and the leakage is prevented. Through experimental analysis, the method proposed in this paper can not only prevent user privacy data leakage in the shortest time, but also improve the accuracy of user data privacy control, which is of great significance to user information security. © 2021 IEEE.",,,"Wang, Zhe (56450904300); Lin, Shaofeng (57199122713); Zhang, Mingjiang (57208129985); Nie, Shaotao (57223264267)",56450904300; 57199122713; 57208129985; 57223264267,"Proceedings - 2021 6th International Conference on Smart Grid and Electrical Automation, ICSGEA 2021",9470381,427.0,430.0,3.0,0.0,https://www.scopus.com/inward/record.uri?eid=2-s2.0-85111147005&doi=10.1109%2fICSGEA53208.2021.00103&partnerID=40&md5=444bf5ebd5f1df8517b49c13c81600d0,Blockchain; Control; Data leakage; user privacy,Blockchain; Cryptography; Electric power transmission networks; Probability distributions; Smart power grids; Asymmetric encryption; Conditional probability distributions; Control methods; Data leakage; Experimental analysis; Privacy control; User data; User privacy; Privacy by design,Conference paper,Final,,2-s2.0-85111147005,,,,,,,,,,,,
,He X.; Guo H.; Cheng X.,Blockchain-Based Privacy Protection Scheme for IoT-Assisted Educational Big Data Management,2021.0,Scopus,,,,,,,10.1155/2021/3558972,,,2021,,,,,,,,,"Adoption of the Internet of Things (IoT) in education brings many benefits. However, the poor implementation of access control of educational data produced by the IoT devices has brought students' and teachers' privacy into danger. Attackers can access educational data that they are not permitted to access and even erase the records during access. To tackle this problem, we employ blockchain technology to guarantee the integrity of access control rules and trace the records of access events. In this paper, we propose a blockchain-based access control scheme for the data produced by IoT devices. The scheme consists of three components: (1) a well-implemented data collection module that is deployed in smart classrooms, which collects and uploads data about the real-time situation inside the smart classroom to the data center; (2) a MongoDB-based data center and its control module that makes access control decisions based on the verification of the permissions of visitors, where the permissions are managed by blockchain; and (3) a customized blockchain system that stores and keeps security policy updates of the role-based access control module and records access events in a trusted way. Our analysis indicates that the proposed access control scheme guarantees the correctness of the access control process and makes the access of collected educational data auditable and responsible. Our system collectively analyzes the context of the smart classroom and is capable of detecting multiple scenarios such as absence, lateness, and gunshot. We show how the scheme preserves students' and teachers' privacy by carrying out extensive experimental studies. The results indicate that the proposed data management system can give correct responses as quickly as a traditional data server does while preserving privacy. © 2021 Xiaoshuang He et al.",,,"He, Xiaoshuang (57237594200); Guo, Hechuan (57220980930); Cheng, Xueyu (57235912300)",57237594200; 57220980930; 57235912300,Wireless Communications and Mobile Computing,3558972,,,,5.0,https://www.scopus.com/inward/record.uri?eid=2-s2.0-85113756892&doi=10.1155%2f2021%2f3558972&partnerID=40&md5=aa19899efd1eeb02c50f84fc9b121972,,Access control; Big data; Blockchain; Information management; Privacy by design; Students; Access control decisions; Access control schemes; Data collection modules; Data management system; Internet of thing (IOT); Privacy protection; Role-based Access Control; Three component; Internet of things,Article,Final,All Open Access; Gold Open Access,2-s2.0-85113756892,,,,,,,,,,,,
