Cites,Authors,Title,Year,Source,Publisher,ArticleURL,CitesURL,GSRank,QueryDate,Type,DOI,ISSN,CitationURL,Volume,Issue,StartPage,EndPage,ECC,CitesPerYear,CitesPerAuthor,AuthorCount,Age,Abstract,FullTextURL,RelatedURL,Author full names,Author(s) ID,Source title,Art. No.,Page start,Page end,Page count,Cited by,Link,Author Keywords,Index Keywords,Document Type,Publication Stage,Open Access,EID,Item type,Journal,Publication year,Pages,Address,Proceedings title,Conference location,Date published,ISBN,URLs,Keywords,Series
,Chen L.; Yu Q.; Liang W.; Cai J.; Zhu H.; Xie S.,Overview of Medical Data Privacy Protection based on Blockchain Technology,2022.0,Scopus,,,,,,,10.1109/SmartCloud55982.2022.00039,,,,,,,,,,,,"With the increasing growth of electronic medical data, the difficulties of data sharing among medical institutions and the leakage of data privacy have become the focus of the public and medical workers. The blockchain has the characteristics of decentralization, traceability, and immutability, which can provide new ideas for fine-grained secure access to medical research. This article first introduces blockchain and blockchain-based privacy protection technology; then analyzes the advantages and disadvantages of electronic medical records, and introduces the current development status of electronic medical records based on blockchain technology; then from data encryption, access the three aspects of control and transaction anonymity introduce the medical data privacy protection method based on blockchain technology; finally, the full text is summarized and prospected.  © 2022 IEEE.",,,"Chen, Lin (57802323800); Yu, Qingchun (57988210600); Liang, Wei (57730599700); Cai, Jiahong (57226277744); Zhu, Hangyu (57802205300); Xie, Songyou (57194024171)",57802323800; 57988210600; 57730599700; 57226277744; 57802205300; 57194024171,"Proceedings - 2022 IEEE 7th International Conference on Smart Cloud, SmartCloud 2022",,200.0,205.0,5.0,3.0,https://www.scopus.com/inward/record.uri?eid=2-s2.0-85143048970&doi=10.1109%2fSmartCloud55982.2022.00039&partnerID=40&md5=8822e9f1e34912709b5d3ced829dae41,Access control; Blockchain; Data encryption; Medical data privacy; Transaction anonymity,Access control; Cryptography; Data privacy; Medical computing; Block-chain; Data encryption; Data privacy protections; Data Sharing; Decentralisation; Medical data; Medical institutions; Medical record; Transaction anonymity; Workers'; Blockchain,Conference paper,Final,,2-s2.0-85143048970,,,,,,,,,,,,
,Zhang J.; Zhong C.,Differential Privacy-Based Double Auction for Data Market in Blockchain-Enhanced Internet of Things,2022.0,Scopus,,,,,,,10.1155/2022/8038846,,,2022,,,,,,,,,"With the rapid development of the Internet of Things (IoT), large amounts of data are collected, which constitute a valuable business resource. Hence, a suitable IoT data market needs to be established, and the provision of safe and effective trading services for multiple buyers and sellers is required. This paper introduces an IoT data market framework supported by blockchain. It focuses on a transaction realization scheme for multiple buyers and sellers. In the scheme, the mechanisms are designed to determine the corresponding data providers and recipients for the buyers and sellers, respectively, and the transaction prices of both parties. When the data market runs, an inference attack will raise bid information leakage issues. We study a transaction scheme that enables differential privacy protection of bids based on an exponential mechanism. This paper theoretically proves the individual rationality, weak budget balance, and truthfulness of the normal transaction scheme and differential privacy-based transaction scheme. This paper also theoretically proves the effectiveness of the differential privacy protection for bids of transaction participants. Furthermore, this paper verifies the performances of the two schemes through digital simulation experiments. From the experiments, we can also prove that these schemes occupy reasonable social welfare and computational overhead.  © 2022 Junhua Zhang and Caiming Zhong.",,,"Zhang, Junhua (7801693683); Zhong, Caiming (24339688900)",7801693683; 24339688900,Wireless Communications and Mobile Computing,8038846,,,,4.0,https://www.scopus.com/inward/record.uri?eid=2-s2.0-85133568456&doi=10.1155%2f2022%2f8038846&partnerID=40&md5=f4ab4a35eea0491ab828d759036694ec,,Blockchain; Budget control; Commerce; Data privacy; Sales; Block-chain; Business resources; Buyers and sellers; Differential privacies; Double auction; Large amounts of data; Market framework; Market needs; Privacy protection; Trading services; Internet of things,Article,Final,All Open Access; Gold Open Access,2-s2.0-85133568456,,,,,,,,,,,,
,Hrovatin N.; Tošić A.; Mrissa M.; Kavšek B.,Privacy-Preserving Data Mining on Blockchain-Based WSNs,2022.0,Scopus,,,,,,,10.3390/app12115646,,,12,11,,,,,,,,"Currently, the computational power present in the sensors forming a wireless sensor network (WSN) allows for implementing most of the data processing and analysis directly on the sensors in a decentralized way. This shift in paradigm introduces a shift in the privacy and security problems that need to be addressed. While a decentralized implementation avoids the single point of failure problem that typically applies to centralized approaches, it is subject to other threats, such as external monitoring, and new challenges, such as the complexity of providing decentralized implementations for data mining algorithms. In this paper, we present a solution for privacy-aware distributed data mining on wireless sensor networks. Our solution uses a permissioned blockchain to avoid a single point of failure in the system. Contracts are used to construct an onion-like structure encompassing the Hoeffding trees and a route. The onion-routed query conceals the network identity of the sensors from external adversaries, and obfuscates the actual computation to hide it from internally compromised nodes. We validate our solution on a use case related to an air quality-monitoring sensor network. We compare the quality of our model against traditional models to support the feasibility and viability of the solution. © 2022 by the authors. Licensee MDPI, Basel, Switzerland.",,,"Hrovatin, Niki (57225191729); Tošić, Aleksandar (55559996100); Mrissa, Michael (8539900000); Kavšek, Branko (8860378000)",57225191729; 55559996100; 8539900000; 8860378000,Applied Sciences (Switzerland),5646,,,,4.0,https://www.scopus.com/inward/record.uri?eid=2-s2.0-85131784409&doi=10.3390%2fapp12115646&partnerID=40&md5=3d25b3e0c3b6050eba82b62c79977d1b,air quality; blockchain; data mining; privacy; WSN,,Article,Final,All Open Access; Gold Open Access; Green Open Access,2-s2.0-85131784409,,,,,,,,,,,,
,Rani P.; Verma S.; Yadav S.P.; Rai B.K.; Naruka M.S.; Kumar D.,Simulation of the Lightweight Blockchain Technique Based on Privacy and Security for Healthcare Data for the Cloud System,2022.0,Scopus,,,,,,,10.4018/IJEHMC.309436,,,13,4,,,,,,,,"Information about healthcare is derived from healthcare data. Healthcare data sharing helps make healthcare systems more efficient as well as improving healthcare quality. Patients should own and control healthcare information, one of their most valuable assets, instead of letting data be spread out among health care providers differ. This protects data from being shared between healthcare systems and privacy. Public ledger accompanied by a decentralized network of peer’s compromises patient has been demonstrated to be able to achieve trusted, auditable computing by blockchain. The use of access control and cryptographic primitives are insufficient in addressing modern cyber threats all privacy and security concerns associated with a cloud-based environment. In this paper, the authors proposed a lightweight blockchain technique based on privacy and security for healthcare data for the cloud system. The cost-effectiveness of our system’s smart contracts is evaluated, as well as the procedures used for data processing in order to encrypt and pseudonymize patient data. © 2022 IGI Global. All rights reserved.",,,"Rani, Preeti (57225387540); Verma, Sonia (58277858300); Yadav, Satya Prakash (57209717559); Rai, Bipin Kumar (57420954100); Naruka, Mahaveer Singh (56829546100); Kumar, Devendra (57212687921)",57225387540; 58277858300; 57209717559; 57420954100; 56829546100; 57212687921,International Journal of E-Health and Medical Communications,,,,,9.0,https://www.scopus.com/inward/record.uri?eid=2-s2.0-85148770721&doi=10.4018%2fIJEHMC.309436&partnerID=40&md5=50e0075ce2c70c2e2fc6bf7972e0bc63,Blockchain Model; Cloud System; Data Management; Health Care; IoT; Privacy and Security; Smart Contract; Smart System,,Article,Final,All Open Access; Bronze Open Access,2-s2.0-85148770721,,,,,,,,,,,,
,Zhang G.; Yang Z.; Liu W.,Blockchain-based privacy preserving e-health system for healthcare data in cloud,2022.0,Scopus,,,,,,,10.1016/j.comnet.2021.108586,,,203,,,,,,,,,"Cloud-assisted electronic health (e-health) system has played an important role in the management of healthcare data, which can provide efficient and convenient storage services for the patients to store their electronic health records (EHRs). However, there are the security challenges in the existing e-health system, where the malicious doctors may collude with cloud storage service provider (CSP) to tamper with the patients’ EHRs, or directly reveal the content of EHRs to other adversaries for profit. In this paper, we propose a blockchain-based privacy preserving e-health system to ensure the security and confidentiality of the patients’ EHRs. In the system, we introduce the pairing-based cryptography to generate the tamper-proof records of the EHRs and allow the patients to integrate them into the transactions deployed on the blockchain, which can make the patients’ EHRs verifiable and protect them from illegal modification. Moreover, we will design secure payment protocols by performing blockchain-based smart contracts, which can enable the patients and hospital to reliably pay for the diagnostic and storage service, respectively. Security analysis and the performance evaluation demonstrate that our proposed scheme is secure and efficient with a limited computation overhead. © 2021 Elsevier B.V.",,,"Zhang, Guipeng (57191841521); Yang, Zhenguo (56828347100); Liu, Wenyin (22433292200)",57191841521; 56828347100; 22433292200,Computer Networks,108586,,,,28.0,https://www.scopus.com/inward/record.uri?eid=2-s2.0-85119442442&doi=10.1016%2fj.comnet.2021.108586&partnerID=40&md5=0e86e510af16638e112835ff02a80049,Blockchain; Electronic health record; Electronic health system; Privacy preserving; Smart contract,Diagnosis; Digital storage; eHealth; Electronic structure; Information management; Privacy-preserving techniques; Public key cryptography; Records management; Block-chain; Cloud storage services; Electronic health system; Pairing-based cryptography; Payment protocol; Privacy preserving; Security challenges; Storage service providers; Storage services; Tamperproof; Smart contract,Article,Final,,2-s2.0-85119442442,,,,,,,,,,,,
,Xu W.,Financial Data Privacy Protection Framework Construction Based on Blockchain Technology,2022.0,Scopus,,,,,,,10.1109/ICENIT57306.2022.00058,,,,,,,,,,,,"In the era of big data, the traditional centralized data processing mode is not conducive to data security, data sharing, the reduction of data transaction cost and the full mining of data value. The unique data structure, distributed storage and consensus mechanism of blockchain technology have unique advantages in ensuring data security and sharing. However, the openness and distributed storage of Blockchain also make data privacy protection become a difficult problem. Specific to the financial field, the disclosure of financial data privacy will not only concern the privacy of users, the reputation of financial industry, but also concern China's financial security. Based on this, this paper takes Blockchain as the underlying technology of financial data application to discuss the privacy protection of financial data from the perspectives of technology and regulation. Finally, this paper constructs a financial data privacy protection framework of 'Blockchain+privacy computing technology+regulation' in order to create a good dynamic environment for the security, sharing and privacy protection of financial data.  © 2022 IEEE.",,,"Xu, Weishuang (57926934200)",57926934200,"Proceedings - 2022 International Conference on Education, Network and Information Technology, ICENIT 2022",,234.0,238.0,4.0,0.0,https://www.scopus.com/inward/record.uri?eid=2-s2.0-85148867041&doi=10.1109%2fICENIT57306.2022.00058&partnerID=40&md5=03ebbe1df21aea2d9eff2ba9f28323cc,Blockchain technology; financial data; framework construction; privacy protection,Digital storage; Finance; Internet of things; Privacy-preserving techniques; % reductions; Block-chain; Blockchain technology; Centralised; Data privacy protections; Distributed storage; Financial data; Framework construction; Privacy protection; Security data sharing; Blockchain,Conference paper,Final,,2-s2.0-85148867041,,,,,,,,,,,,
,Saidi H.; Labraoui N.; Ari A.A.A.; Maglaras L.A.; Emati J.H.M.,DSMAC: Privacy-Aware Decentralized Self-Management of Data Access Control Based on Blockchain for Health Data,2022.0,Scopus,,,,,,,10.1109/ACCESS.2022.3207803,,,10,,,,,,,,,"In recent years, the interest in using wireless communication technologies and mobile devices in the healthcare environment has increased. However, despite increased attention to the security of electronic health records, patient privacy is still at risk for data breaches. Thus, it is quite a challenge to involve an access control system especially if the patient's medical data are accessible by users who have diverse privileges in different situations. Blockchain is a new technology that can be adopted for decentralized access control management issues. Nevertheless, different scalability, security, and privacy challenges affect this technology. To address these issues, we suggest a novel Decentralized Self-Management of data Access Control (DSMAC) system using a blockchain-based Self-Sovereign Identity (SSI) model for privacy-preserving medical data, empowering patients with mechanisms to preserve control over their personal information and allowing them to self-grant access rights to their medical data. DSMAC leverages smart contracts to conduct Role-based Access Control policies and adopts the implementation of decentralized identifiers and verifiable credentials to describe advanced access control techniques for emergency cases. Finally, by evaluating performance and comparing analyses with other schemes, DSMAC can satisfy the privacy requirements of medical systems in terms of privacy, scalability, and sustainability, and offers a new approach for emergency cases.  © 2013 IEEE.",,,"Saidi, Hafida (57214824611); Labraoui, Nabila (36179757000); Ari, Ado Adamou Abba (57193017438); Maglaras, Leandros A. (8313447200); Emati, Joel Herve Mboussam (57919317500)",57214824611; 36179757000; 57193017438; 8313447200; 57919317500,IEEE Access,,101011.0,101028.0,17.0,13.0,https://www.scopus.com/inward/record.uri?eid=2-s2.0-85139447854&doi=10.1109%2fACCESS.2022.3207803&partnerID=40&md5=e5b264ad295f4b8d1255ca27b3e1c581,Blockchain; data privacy; decentralized access control; decentralized identifier (DID); IoMT sensors; self sovereign identity (SSI); smart contract; verifiable credential (VC),Access control; Blockchain; Health risks; Information management; Medical information systems; mHealth; Mobile telecommunication systems; Privacy-preserving techniques; Scalability; Block-chain; Data access control; Decentralised; Decentralized access control; Decentralized identifier; IoMT sensor; Medical data; Self management; Self sovereign identity; Verifiable credential; Smart contract,Article,Final,All Open Access; Gold Open Access; Green Open Access,2-s2.0-85139447854,,,,,,,,,,,,
,Khedekar V.B.; Hiremath S.S.; Sonawane P.M.; Rajput D.S.,Protection to personal data using decentralizing privacy of blockchain,2022.0,Scopus,,,,,,,10.4018/978-1-6684-7132-6.ch032,,,,,,,,,,,,"In today's world, we deal with various online services, where each person deals with various technologies. These technologies are made for people to make our access to the new world easily. There is a tremendous use of online applications, websites which require large storage. Large data is handled by the online systems. The collection of data in the whole world is about 20% in the last few years. The data is captured from the user, controlled by the systems, and operations are performed on data. It requires more system accuracy and protection to personal data. But the person does not know about the data, where and how it is used where it is stored or whether the data is handled by some organisations for their own use or data is been hacked by another person. This chapter explores protection of data using the decentralized privacy of blockchain. © 2023, IGI Global. All rights reserved.",,,"Khedekar, Vilas Baburao (58315286400); Hiremath, Shruti Sangmesh (58316019000); Sonawane, Prashant Madhav (58314286600); Rajput, Dharmendra Singh (57189366629)",58315286400; 58316019000; 58314286600; 57189366629,"Research Anthology on Convergence of Blockchain, Internet of Things, and Security",,570.0,587.0,17.0,0.0,https://www.scopus.com/inward/record.uri?eid=2-s2.0-85161978388&doi=10.4018%2f978-1-6684-7132-6.ch032&partnerID=40&md5=9e35c1bf2d301ae90a87e1a3acef2c54,,,Book chapter,Final,,2-s2.0-85161978388,,,,,,,,,,,,
,Duan H.; Yang J.; Yang H.,A Blockchain-Based Privacy Protection Application for Logistics Big Data,2022.0,Scopus,,,,,,,10.4018/JCIT.295249,,,24,5,,,,,,,,"Logistics business is generally managed by logistics orders in plain text, and there is a risk of disclosure of customer privacy information in every business link. In order to solve the problem of privacy protection in logistics big data systems, a new kind of logistics user privacy data protection scheme is proposed. First of all, an access rights management mechanism is designed by combining blockchain and anonymous authentication to realize the control and management of users’ access rights to private data. Then, the privacy and confidentiality protection between different services is realized by dividing and storing the data of different services. Finally, the participants of the intra-chain private data are specified by embedding fields in the logistics information. The blockchain node receiving the transaction is used as the transit node to synchronize the intra-chain privacy data, so as to improve the intra-chain privacy protection within the business. Experimental results show that the proposed method can satisfy the privacy requirements and ensure considerable performance. © 2022 IGI Global. All rights reserved.",,,"Duan, Huabin (57450044400); Yang, Jie (57451296700); Yang, Huanjun (57450941100)",57450044400; 57451296700; 57450941100,Journal of Cases on Information Technology,,,,,0.0,https://www.scopus.com/inward/record.uri?eid=2-s2.0-85124548643&doi=10.4018%2fJCIT.295249&partnerID=40&md5=7d3c806f408e93e146182e233db513c8,Big data; Blockchain; Logistics; Privacy protection,Big data; Blockchain; Block-chain; Business links; Customer privacy; Different services; Plain text; Privacy information; Privacy protection; Private data; Problem of privacy; Protection application; Data privacy,Article,Final,All Open Access; Bronze Open Access,2-s2.0-85124548643,,,,,,,,,,,,
,Zhao Y.; Yang X.; Yu Y.; Qin B.; Du X.; Guizani M.,Blockchain-Based Auditable Privacy-Preserving Data Classification for Internet of Things,2022.0,Scopus,,,,,,,10.1109/JIOT.2021.3097890,,,9,4,,,,,,,,"Internet of Things (IoT) connects massive physical devices to capture and collect useful data, which are used to make accurate decisions by taking advantage of the machine learning techniques. However, the collected data may contain users' sensitive information. When guaranteeing the utility of data, we need to consider privacy of users' data. To balance the utility and the privacy of data, the existing approaches usually adopt the privacy-preserving signature technology, where the privacy-preserving data are classified by a designated converter (data processor) interacting with a semihonest verifier (data center). However, for the malicious behavior of the data center and data processor, this kind of approach is insufficient. To prevent the malicious data center/data processor while guaranteeing the utility and privacy of data, we propose blockchain-based auditable privacy-preserving data classification (PPDC) scheme for IoT. We put forth a new controllably linkable group signature (CL-GS) to balance the utility and privacy of data and take advantage of blockchain to audit the correctness of privacy-preserving data classification against malicious data processor/data center. We formalize the system model of the auditable privacy-preserving data classification in the blockchain setting and its security model. Then, we present a concrete construction and prove its security in the random oracle model. Finally, we deploy a prototype system to evaluate the performance of PPDC.  © 2014 IEEE.",,,"Zhao, Yanqi (57200443911); Yang, Xiaoyi (57203369003); Yu, Yong (55628587839); Qin, Baodong (22635431900); Du, Xiaojiang (8371278000); Guizani, Mohsen (7004750176)",57200443911; 57203369003; 55628587839; 22635431900; 8371278000; 7004750176,IEEE Internet of Things Journal,,2468.0,2484.0,16.0,7.0,https://www.scopus.com/inward/record.uri?eid=2-s2.0-85110792503&doi=10.1109%2fJIOT.2021.3097890&partnerID=40&md5=0eaba5ebe0e196aa8ba50305a37be250,Auditing; Blockchain; Data classification; Group signatures; Internet of Things (IoT),Blockchain; Cryptography; Internet of things; Learning systems; Privacy by design; Data classification; Group signatures; Machine learning techniques; Physical devices; Privacy preserving; Prototype system; Random Oracle model; Sensitive informations; Classification (of information),Article,Final,,2-s2.0-85110792503,,,,,,,,,,,,
,Qu Y.; Chen S.; Gao L.; Cui L.; Sood K.; Yu S.,Personalized Privacy-Preserving Medical Data Sharing for Blockchain-based Smart Healthcare Networks,2022.0,Scopus,,,,,,,10.1109/ICC45855.2022.9839288,,,2022-May,,,,,,,,,"With the growing proliferation of intelligent end devices and data analytics techniques, real momentum towards the development of smart healthcare networks (SHN) has already been evident. Multiple parties in SHNs continuously exchange medical data in order to achieve a precise diagnosis and process optimization. Privacy issue emerges since medical data are susceptible, while the combination of a series of medical data may lead to further privacy leakage. Adversaries launch unceasingly launch poisoning attacks, a dominant attack to maliciously manipulate data, severely impact the authenticity of the data transmitting over the SHNs, leading to misdiagnosing or even physical damage. In this paper, we propose a personalized differential privacy model built upon blockchain, in which the community density is exploited to customize the degree of privacy protection and inject corresponding noise data. Besides using blockchain as the underlying network architecture to defeat poisoning attacks. The proposed model can guarantee the authentication of the differentially private data, traceability of data, and single-point failure avoidance in SHN. Evaluation and extensive results using real-world data sets demonstrate the superiority of the proposed model. © 2022 IEEE.",,,"Qu, Youyang (57193560269); Chen, Shiping (35241832100); Gao, Longxiang (36133254500); Cui, Lei (57213045163); Sood, Keshav (56416123500); Yu, Shui (55741361200)",57193560269; 35241832100; 36133254500; 57213045163; 56416123500; 55741361200,IEEE International Conference on Communications,,4229.0,4234.0,5.0,2.0,https://www.scopus.com/inward/record.uri?eid=2-s2.0-85137262005&doi=10.1109%2fICC45855.2022.9839288&partnerID=40&md5=049faf32a34c5c7254130468e4d52107,,Authentication; Data Analytics; Diagnosis; Health care; Network architecture; Optimization; Privacy-preserving techniques; Analytic technique; Block-chain; Data analytics; Data Sharing; End-devices; Medical data; Poisoning attacks; Privacy issue; Privacy preserving; Process optimisation; Blockchain,Conference paper,Final,,2-s2.0-85137262005,,,,,,,,,,,,
