Cites,Authors,Title,Year,Source,Publisher,ArticleURL,CitesURL,GSRank,QueryDate,Type,DOI,ISSN,CitationURL,Volume,Issue,StartPage,EndPage,ECC,CitesPerYear,CitesPerAuthor,AuthorCount,Age,Abstract,FullTextURL,RelatedURL,Author full names,Author(s) ID,Source title,Art. No.,Page start,Page end,Page count,Cited by,Link,Author Keywords,Index Keywords,Document Type,Publication Stage,Open Access,EID,Item type,Journal,Publication year,Pages,Address,Proceedings title,Conference location,Date published,ISBN,URLs,Keywords,Series
39.0,"V Wylde, N Rawindaran, J Lawrence, ...","Cybersecurity, data privacy and blockchain: a review",2022.0,SN Computer …,Springer,https://link.springer.com/article/10.1007/s42979-022-01020-4,"https://scholar.google.com/scholar?cites=2018266879693533478&as_sdt=2005&sciodt=0,5&hl=en",1.0,2023-11-16 18:25:10,HTML,10.1007/s42979-022-01020-4,,,,,,,39.0,39.0,10.0,4.0,1.0,"… utilising Blockchain technology. The challenges indicated are Cybersecurity and Data privacy in … Additional challenges are set out supported by literature, in researching data security …",https://link.springer.com/article/10.1007/s42979-022-01020-4,"https://scholar.google.com/scholar?q=related:JrERqghTAhwJ:scholar.google.com/&scioq=intitle:blockchain+intitle:data+intitle:privacy&hl=en&as_sdt=0,5",,,,,,,,,,,,,,,,,,,,,,,,,,,
11.0,"SMY Aks, M Karmila, B Givan, ...",A Review of Blockchain for Security Data Privacy with Metaverse,2022.0,… Conference on ICT …,ieeexplore.ieee.org,https://ieeexplore.ieee.org/abstract/document/9915055/,"https://scholar.google.com/scholar?cites=3003386233669775592&as_sdt=2005&sciodt=0,5&hl=en",2.0,2023-11-16 18:25:10,,,,,,,,,11.0,11.0,3.0,4.0,1.0,"… blockchain method, by paying attention to data security in privacy, with this concept, the distribution of data will be safer because it uses the blockchain method. In this research, how to …",,"https://scholar.google.com/scholar?q=related:6HAv7d0rrikJ:scholar.google.com/&scioq=intitle:blockchain+intitle:data+intitle:privacy&hl=en&as_sdt=0,5",,,,,,,,,,,,,,,,,,,,,,,,,,,
11.0,"J Liu, J Zhao, H Huang, G Xu",A novel logistics data privacy protection method based on blockchain,2022.0,Multimedia Tools and Applications,Springer,https://link.springer.com/article/10.1007/s11042-022-12836-w,"https://scholar.google.com/scholar?cites=139374227430545217&as_sdt=2005&sciodt=0,5&hl=en",10.0,2023-11-16 18:25:10,,10.1007/s11042-022-12836-w,,,,,,,11.0,11.0,3.0,4.0,1.0,"… access rights to different data, to achieve the purpose of data privacy protection. The traditional … with blockchain, we can rely on the decentralized nature of blockchain to make the data …",,"https://scholar.google.com/scholar?q=related:QZfXFB8o7wEJ:scholar.google.com/&scioq=intitle:blockchain+intitle:data+intitle:privacy&hl=en&as_sdt=0,5",,,,,,,,,,,,,,,,,,,,,,,,,,,
19.0,"F Loukil, C Ghedira-Guegan, K Boukadi, ...",Data privacy based on IoT device behavior control using blockchain,2021.0,ACM Transactions on …,dl.acm.org,https://dl.acm.org/doi/abs/10.1145/3434776,"https://scholar.google.com/scholar?cites=10676408622366521106&as_sdt=2005&sciodt=0,5&hl=en",14.0,2023-11-16 18:25:10,,10.1145/3434776,,,,,,,19.0,9.5,5.0,4.0,2.0,… to preserve privacy in a private area network using the blockchain technology. The objective … enables the data owner to control the IoT devices first by defining the privacy permission …,http://eprints.staffs.ac.uk/7502/1/Accepted_TOIT_Paper.pdf,"https://scholar.google.com/scholar?q=related:EvcSdRM5KpQJ:scholar.google.com/&scioq=intitle:blockchain+intitle:data+intitle:privacy&hl=en&as_sdt=0,5",,,,,,,,,,,,,,,,,,,,,,,,,,,
6.0,"Q Zhang, H Lv, J Ma, J Li, J Zhang",Overview of Blockchain Data Privacy Protection,2021.0,… of the 2021 3rd Blockchain and …,dl.acm.org,https://dl.acm.org/doi/abs/10.1145/3475992.3476000,"https://scholar.google.com/scholar?cites=10265875012838232211&as_sdt=2005&sciodt=0,5&hl=en",15.0,2023-11-16 18:25:10,,10.1145/3475992.3476000,,,,,,,6.0,3.0,1.0,5.0,2.0,"… of blockchain. In this paper, the basic principle of blockchain technology, data privacy threats, data privacy protection methods, and the future of blockchain data privacy protection are …",,"https://scholar.google.com/scholar?q=related:kxDI6O62d44J:scholar.google.com/&scioq=intitle:blockchain+intitle:data+intitle:privacy&hl=en&as_sdt=0,5",,,,,,,,,,,,,,,,,,,,,,,,,,,
23.0,"D Amo, D Fonseca, M Alier, FJ García-Peñalvo, ...",Personal data broker instead of blockchain for students' data privacy assurance,2019.0,New Knowledge in …,Springer,https://link.springer.com/chapter/10.1007/978-3-030-16187-3_36,"https://scholar.google.com/scholar?cites=4337984496533390593&as_sdt=2005&sciodt=0,5&hl=en",20.0,2023-11-16 18:25:10,,10.1007/978-3-030-16187-3_36,,,,,,,23.0,5.75,5.0,5.0,4.0,"… of Blockchain related to the privacy and data security … the Blockchain a suitable technology to ensure data privacy … motivated by the upward trend of Blockchain’s use, advocate …",https://upcommons.upc.edu/bitstream/handle/2117/166615/worldcist2019_v10_camera_ready.pdf,"https://scholar.google.com/scholar?q=related:AUUGfeqdMzwJ:scholar.google.com/&scioq=intitle:blockchain+intitle:data+intitle:privacy&hl=en&as_sdt=0,5",,,,,,,,,,,,,,,,,,,,,,,,,,,
13.0,"KM Lee, I Ra",Data privacy-preserving distributed knowledge discovery based on the blockchain,2020.0,Information Technology and Management,Springer,https://link.springer.com/article/10.1007/s10799-020-00317-1,"https://scholar.google.com/scholar?cites=7951885931945361734&as_sdt=2005&sciodt=0,5&hl=en",25.0,2023-11-16 18:25:10,,10.1007/s10799-020-00317-1,,,,,,,13.0,4.33,7.0,2.0,3.0,… Here we propose a blockchain-based method to discourage the participants to cheat or be … data privacy. The proposed method gives penalty to the betraying parties in the data privacy-…,,"https://scholar.google.com/scholar?q=related:RoEHzB_GWm4J:scholar.google.com/&scioq=intitle:blockchain+intitle:data+intitle:privacy&hl=en&as_sdt=0,5",,,,,,,,,,,,,,,,,,,,,,,,,,,
16.0,"J Gong, Y Mei, F Xiang, H Hong, ...",A data privacy protection scheme for Internet of things based on blockchain,2021.0,Transactions on …,Wiley Online Library,https://onlinelibrary.wiley.com/doi/abs/10.1002/ett.4010,"https://scholar.google.com/scholar?cites=11364120833744463945&as_sdt=2005&sciodt=0,5&hl=en",27.0,2023-11-16 18:25:10,,10.1002/ett.4010,,,,,,,16.0,8.0,3.0,5.0,2.0,"… of data privacy leakage currently facing the IoT, this article uses blockchain technology to … proposes a blockchain-based data privacy protection scheme for the IoT. This article uses …",,"https://scholar.google.com/scholar?q=related:SWj0R7B3tZ0J:scholar.google.com/&scioq=intitle:blockchain+intitle:data+intitle:privacy&hl=en&as_sdt=0,5",,,,,,,,,,,,,,,,,,,,,,,,,,,
17.0,"TDT Nguyen, HA Pham, MT Thai",Leveraging blockchain to enhance data privacy in IoT-based applications,2018.0,… Data and Social Networks: 7th …,Springer,https://link.springer.com/chapter/10.1007/978-3-030-04648-4_18,"https://scholar.google.com/scholar?cites=17777423332125945171&as_sdt=2005&sciodt=0,5&hl=en",29.0,2023-11-16 18:25:10,,10.1007/978-3-030-04648-4_18,,,,,,,17.0,3.4,6.0,3.0,5.0,… how blockchain can be leveraged to tackle data privacy … full control over their data and can track how data are accessed by … using blockchain that helps prevent fraudulent data caused …,https://www.researchgate.net/profile/Truc-Nguyen-43/publication/329015471_Leveraging_Blockchain_to_Enhance_Data_Privacy_in_IoT-Based_Applications/links/5bf785cca6fdcc538813b909/Leveraging-Blockchain-to-Enhance-Data-Privacy-in-IoT-Based-Applications.pdf,"https://scholar.google.com/scholar?q=related:U60b7VQYtvYJ:scholar.google.com/&scioq=intitle:blockchain+intitle:data+intitle:privacy&hl=en&as_sdt=0,5",,,,,,,,,,,,,,,,,,,,,,,,,,,
29.0,"F Daneshgar, O Ameri Sianaki, ...",Blockchain: a research framework for data security and privacy,2019.0,"Web, Artificial Intelligence …",Springer,https://link.springer.com/chapter/10.1007/978-3-030-15035-8_95,"https://scholar.google.com/scholar?cites=4726348822490816233&as_sdt=2005&sciodt=0,5&hl=en",30.0,2023-11-16 18:25:10,,10.1007/978-3-030-15035-8_95,,,,,,,29.0,7.25,10.0,3.0,4.0,"… theme called ‘blockchain data security and privacy’, and … such as ‘blockchain (security) applications’, ‘blockchain (security) … , a blockchain-based architecture for preserving data privacy, …",https://www.researchgate.net/profile/Farhad-Daneshgar/publication/331760491_Blockchain_A_Research_Framework_for_Data_Security_and_Privacy/links/5d05da82458515b055d55a50/Blockchain-A-Research-Framework-for-Data-Security-and-Privacy,"https://scholar.google.com/scholar?q=related:6Z4meTZdl0EJ:scholar.google.com/&scioq=intitle:blockchain+intitle:data+intitle:privacy&hl=en&as_sdt=0,5",,,,,,,,,,,,,,,,,,,,,,,,,,,
12.0,"P Moriggl, PM Asprion, B Schneider",Blockchain technologies towards data privacy—hyperledger sawtooth as unit of analysis,2021.0,New Trends in Business Information …,Springer,https://link.springer.com/chapter/10.1007/978-3-030-48332-6_20,"https://scholar.google.com/scholar?cites=2507852262123357504&as_sdt=2005&sciodt=0,5&hl=en",32.0,2023-11-16 18:25:10,,10.1007/978-3-030-48332-6_20,,,,,,,12.0,6.0,4.0,3.0,2.0,"… —data privacy and blockchain—are elaborated in Sect. 2. In Sect. 3, we discuss the characteristics forming the morphological box; as baseline, we use blockchain and data privacy …",https://www.researchgate.net/profile/Petra-Asprion/publication/342784110_Blockchain_Technologies_Towards_Data_Privacy-Hyperledger_Sawtooth_as_Unit_of_Analysis/links/61aa3c1f29948f41dbc0ab9e/Blockchain-Technologies-Towards-Data-Privacy-Hyperledger-Sawtooth-as-Unit-of-Analysis.pdf,"https://scholar.google.com/scholar?q=related:QMUFYViuzSIJ:scholar.google.com/&scioq=intitle:blockchain+intitle:data+intitle:privacy&hl=en&as_sdt=0,5",,,,,,,,,,,,,,,,,,,,,,,,,,,
24.0,"F Loukil, C Ghedira-Guegan, K Boukadi, ...",Towards an end-to-end IoT data privacy-preserving framework using blockchain technology,2018.0,… Engineering–WISE 2018 …,Springer,https://link.springer.com/chapter/10.1007/978-3-030-02922-7_5,"https://scholar.google.com/scholar?cites=9102242375702792037&as_sdt=2005&sciodt=0,5&hl=en",34.0,2023-11-16 18:25:10,,10.1007/978-3-030-02922-7_5,,,,,,,24.0,4.8,6.0,4.0,5.0,"… privacy, a rigorous privacy model that preserves data privacy while maintaining utility in our framework. In fact, by adding some noise to the transactions, we can prevent blockchain …",https://hal.science/hal-01871493/file/loukil2018towards.pdf,"https://scholar.google.com/scholar?q=related:ZcdFBzepUX4J:scholar.google.com/&scioq=intitle:blockchain+intitle:data+intitle:privacy&hl=en&as_sdt=0,5",,,,,,,,,,,,,,,,,,,,,,,,,,,
116.0,"BK Zheng, LH Zhu, M Shen, F Gao, C Zhang, ...",Scalable and privacy-preserving data sharing based on blockchain,2018.0,Journal of Computer …,Springer,https://link.springer.com/article/10.1007/s11390-018-1840-5,"https://scholar.google.com/scholar?cites=685670300426292095&as_sdt=2005&sciodt=0,5&hl=en",36.0,2023-11-16 18:25:10,,10.1007/s11390-018-1840-5,,,,,,,116.0,23.2,19.0,6.0,5.0,"… 2) We propose a new method to protect multi-party data privacy in blockchain. In this new method, the (p, t)-threshold Paillier cryptosystem is applied to the blockchain. The private key …",https://jcst.ict.ac.cn/en/article/pdf/preview/10.1007/s11390-018-1840-5.pdf,"https://scholar.google.com/scholar?q=related:f8vxYYH9gwkJ:scholar.google.com/&scioq=intitle:blockchain+intitle:data+intitle:privacy&hl=en&as_sdt=0,5",,,,,,,,,,,,,,,,,,,,,,,,,,,
62.0,"MMH Onik, CS Kim, NY Lee, J Yang",Privacy-aware blockchain for personal data sharing and tracking,2019.0,Open Computer Science,degruyter.com,https://www.degruyter.com/document/doi/10.1515/comp-2019-0005/html,"https://scholar.google.com/scholar?cites=3514705382024903759&as_sdt=2005&sciodt=0,5&hl=en",43.0,2023-11-16 18:25:10,,10.1515/comp-2019-0005,,,,,,,62.0,15.5,16.0,4.0,4.0,"… data sharing, deleting, modifying and tracking features to verify the privacy of proposed blockchain … It allows data privacy tracking of the internet of things (IoT) apparatus. However, the …",https://www.degruyter.com/document/doi/10.1515/comp-2019-0005/pdf,"https://scholar.google.com/scholar?q=related:T3y_Wey9xjAJ:scholar.google.com/&scioq=intitle:blockchain+intitle:data+intitle:privacy&hl=en&as_sdt=0,5",,,,,,,,,,,,,,,,,,,,,,,,,,,
104.0,"H Tian, J He, Y Ding",Medical data management on blockchain with privacy,2019.0,Journal of medical systems,Springer,https://link.springer.com/article/10.1007/s10916-018-1144-x,"https://scholar.google.com/scholar?cites=4643381301053638713&as_sdt=2005&sciodt=0,5&hl=en",60.0,2023-11-16 18:25:10,,10.1007/s10916-018-1144-x,,,,,,,104.0,26.0,35.0,3.0,4.0,"… we think its privacy is weak. In this paper, the encrypted data is stored in a blockchain and is … embedded, which balances the integrity, availability and privacy properties of medical data. …",,"https://scholar.google.com/scholar?q=related:OUj-DbGacEAJ:scholar.google.com/&scioq=intitle:blockchain+intitle:data+intitle:privacy&hl=en&as_sdt=0,5",,,,,,,,,,,,,,,,,,,,,,,,,,,
2.0,"T Das, S Mukherjee",Data Privacy in IoT Network Using Blockchain Technology,2022.0,Intelligent Systems for Social Good: Theory and …,Springer,https://link.springer.com/chapter/10.1007/978-981-19-0770-8_10,"https://scholar.google.com/scholar?cites=12884528531159124851&as_sdt=2005&sciodt=0,5&hl=en",63.0,2023-11-16 18:25:10,,10.1007/978-981-19-0770-8_10,,,,,,,2.0,2.0,1.0,2.0,1.0,"… Privacy, Blockchain information are stored in … privacy is not a hidden feature that Blockchain conventionally provides us. Here the data need to be captured in such a way that the privacy …",https://www.researchgate.net/profile/Aleem-Ali/publication/361230641_Prospects_of_'SMART_Farming'_in_Cold_Arid_Region_of_Ladakh_India/links/62b192e3dc817901fc7034f5/Prospects-of-SMART-Farming-in-Cold-Arid-Region-of-Ladakh-India.pdf#page=129,"https://scholar.google.com/scholar?q=related:cwsgFm8Kz7IJ:scholar.google.com/&scioq=intitle:blockchain+intitle:data+intitle:privacy&hl=en&as_sdt=0,5",,,,,,,,,,,,,,,,,,,,,,,,,,,
14.0,"M Al-Abdullah, I Alsmadi, R AlAbdullah, ...",Designing privacy-friendly data repositories: a framework for a blockchain that follows the GDPR,2020.0,"… Policy, Regulation and …",emerald.com,https://www.emerald.com/insight/content/doi/10.1108/DPRG-04-2020-0050/full/html,"https://scholar.google.com/scholar?cites=3655993970143767509&as_sdt=2005&sciodt=0,5&hl=en",64.0,2023-11-16 18:25:10,,10.1108/DPRG-04-2020-0050,,,,,,,14.0,4.67,4.0,4.0,3.0,… ’s focus is a generic literature review about blockchain and GDPR or blockchain and data privacy regulation. Blockchain governance models and technical requirements change on a …,,"https://scholar.google.com/scholar?q=related:1atjQyWzvDIJ:scholar.google.com/&scioq=intitle:blockchain+intitle:data+intitle:privacy&hl=en&as_sdt=0,5",,,,,,,,,,,,,,,,,,,,,,,,,,,
16.0,"H Zhang, G Li, Y Zhang, K Gai, M Qiu",Blockchain-based privacy-preserving medical data sharing scheme using federated learning,2021.0,"… 2021, Tokyo, Japan, August 14–16 …",Springer,https://link.springer.com/chapter/10.1007/978-3-030-82153-1_52,"https://scholar.google.com/scholar?cites=13503143653030581319&as_sdt=2005&sciodt=0,5&hl=en",70.0,2023-11-16 18:25:10,,10.1007/978-3-030-82153-1_52,,,,,,,16.0,8.0,3.0,5.0,2.0,"… of data privacy when sharing medical data, we propose a medical data privacy protection framework based on blockchain (… , we protect privacy by adding differential privacy noise into …",,"https://scholar.google.com/scholar?q=related:R1T1FZzNZLsJ:scholar.google.com/&scioq=intitle:blockchain+intitle:data+intitle:privacy&hl=en&as_sdt=0,5",,,,,,,,,,,,,,,,,,,,,,,,,,,
9.0,"L Javed, A Anjum, BM Yakubu, M Iqbal, ...",ShareChain: Blockchain‐enabled model for sharing patient data using federated learning and differential privacy,2023.0,Expert …,Wiley Online Library,https://onlinelibrary.wiley.com/doi/abs/10.1111/exsy.13131,"https://scholar.google.com/scholar?cites=10425331483112973160&as_sdt=2005&sciodt=0,5&hl=en",71.0,2023-11-16 18:25:10,,10.1111/exsy.13131,,,,,,,9.0,9.0,2.0,5.0,1.0,"… blockchain, local differential privacy (LDP), and federated learning (FL) to ensure the privacy of patients' data … Even though we are achieving data privacy by adding noise, one thing that …",https://www.researchgate.net/profile/Bello-Yakubu-2/publication/362907574_ShareChain_Blockchain-enabled_model_for_sharing_patient_data_using_federated_learning_and_differential_privacy/links/6306d977acd814437fd4da7c/ShareChain-Blockchain-enabled-model-for-sharing-patient-data-using-federated-learning-and-differential-privacy.pdf,"https://scholar.google.com/scholar?q=related:aCOlhL83rpAJ:scholar.google.com/&scioq=intitle:blockchain+intitle:data+intitle:privacy&hl=en&as_sdt=0,5",,,,,,,,,,,,,,,,,,,,,,,,,,,
7.0,"S Rahmadika, KH Rhee",Enhancing data privacy through a decentralised predictive model with blockchain-based revenue,2021.0,… Journal of Ad Hoc and Ubiquitous …,inderscienceonline.com,https://www.inderscienceonline.com/doi/abs/10.1504/IJAHUC.2021.115104,"https://scholar.google.com/scholar?cites=130513218509258723&as_sdt=2005&sciodt=0,5&hl=en",72.0,2023-11-16 18:25:10,,10.1504/IJAHUC.2021.115104,,,,,,,7.0,3.5,4.0,2.0,2.0,… a decentralised approach to enhance data privacy in AI training … on providing privacy for shared storage in a public blockchain … Both schemes are relying on blockchain technology along …,,"https://scholar.google.com/scholar?q=related:47-8qxStzwEJ:scholar.google.com/&scioq=intitle:blockchain+intitle:data+intitle:privacy&hl=en&as_sdt=0,5",,,,,,,,,,,,,,,,,,,,,,,,,,,
4.0,"Y Wang, W Huang, J Yu, K Chen, ...",Data privacy protection method of internet of things based on blockchain technology,2020.0,Journal of Physics …,iopscience.iop.org,https://iopscience.iop.org/article/10.1088/1742-6596/1651/1/012068/meta,"https://scholar.google.com/scholar?cites=6264491564609804679&as_sdt=2005&sciodt=0,5&hl=en",73.0,2023-11-16 18:25:10,,10.1088/1742-6596/1651/1/012068,,,,,,,4.0,1.33,1.0,5.0,3.0,"… privacy protection, this paper analyzes the application value of blockchain in the Internet of things privacy … aspects to solve the Internet of things privacy disclosure and tampering, as well …",https://iopscience.iop.org/article/10.1088/1742-6596/1651/1/012068/pdf,"https://scholar.google.com/scholar?q=related:h5n_JuPx71YJ:scholar.google.com/&scioq=intitle:blockchain+intitle:data+intitle:privacy&hl=en&as_sdt=0,5",,,,,,,,,,,,,,,,,,,,,,,,,,,
325.0,"A Al Omar, MS Rahman, A Basu, S Kiyomoto",Medibchain: A blockchain based privacy preserving platform for healthcare data,2017.0,"… , Privacy, and Anonymity in …",Springer,https://link.springer.com/chapter/10.1007/978-3-319-72395-2_49,"https://scholar.google.com/scholar?cites=16125138873765542631&as_sdt=2005&sciodt=0,5&hl=en",74.0,2023-11-16 18:25:10,,10.1007/978-3-319-72395-2_49,,,,,,,325.0,54.17,81.0,4.0,6.0,… centric healthcare data management system by using Blockchain as storage to attain privacy. Pseudonymity is ensured by using the cryptographic functions to protect patient’s data. …,https://www.researchgate.net/profile/Abdullah-Omar-11/publication/321674033_MediBchain_A_Blockchain_Based_Privacy_Preserving_Platform_for_Healthcare_Data/links/5c860073458515831f9ab07a/MediBchain-A-Blockchain-Based-Privacy-Preserving-Platform-for-Healthcare-Data.pdf,"https://scholar.google.com/scholar?q=related:5zqj_F4AyN8J:scholar.google.com/&scioq=intitle:blockchain+intitle:data+intitle:privacy&hl=en&as_sdt=0,5",,,,,,,,,,,,,,,,,,,,,,,,,,,
2.0,"R Folha, V Times, A Carvalho, A Araújo, ...",FoodChain: A food delivery platform based on blockchain for keeping data privacy,2022.0,… on Database Systems …,Springer,https://link.springer.com/chapter/10.1007/978-3-031-00129-1_43,"https://scholar.google.com/scholar?cites=13057688753512113871&as_sdt=2005&sciodt=0,5&hl=en",78.0,2023-11-16 18:25:10,,10.1007/978-3-031-00129-1_43,,,,,,,2.0,2.0,0.0,5.0,1.0,"… by maintaining the privacy of those involved and eliminating costs and decentralizing data, this article presents a marketplace platform based on smart contracts hosted on a blockchain. …",https://arthurcarvalho.info/publications/2022DASFAA.pdf,"https://scholar.google.com/scholar?q=related:z-azHL06NrUJ:scholar.google.com/&scioq=intitle:blockchain+intitle:data+intitle:privacy&hl=en&as_sdt=0,5",,,,,,,,,,,,,,,,,,,,,,,,,,,
4.0,"B Annane, A Alti, L Laouamer, H Reffad",Cx‐CP‐ABE: Context‐aware attribute‐based access control schema and blockchain technology to ensure scalable and efficient health data privacy,2022.0,Security and Privacy,Wiley Online Library,https://onlinelibrary.wiley.com/doi/abs/10.1002/spy2.249,"https://scholar.google.com/scholar?cites=18240080441153297971&as_sdt=2005&sciodt=0,5&hl=en",79.0,2023-11-16 18:25:10,,10.1002/spy2.249,,,,,,,4.0,4.0,1.0,4.0,1.0,… management while ensuring data integrity and … of blockchain is a hybrid blockchain (private and public) for private/public partnerships. The ABE schema is used with public blockchain …,https://www.researchgate.net/profile/Alti-Adel/publication/361642866_Cx-CP-ABE_Context-aware_attribute-based_access_control_schema_and_blockchain_technology_to_ensure_scalable_and_efficient_health_data_privacy/links/6470876559d5ad5f9c758557/Cx-CP-ABE-Context-aware-attribute-based-access-control-schema-and-blockchain-technology-to-ensure-scalable-and-efficient-health-data-privacy.pdf?_sg%5B0%5D=started_experiment_milestone&origin=journalDetail&_rtd=e30%3D,"https://scholar.google.com/scholar?q=related:Mx5-aYXIIf0J:scholar.google.com/&scioq=intitle:blockchain+intitle:data+intitle:privacy&hl=en&as_sdt=0,5",,,,,,,,,,,,,,,,,,,,,,,,,,,
56.0,"Y Liu, J Zhang, J Zhan",Privacy protection for fog computing and the internet of things data based on blockchain,2021.0,Cluster Computing,Springer,https://link.springer.com/article/10.1007/s10586-020-03190-3,"https://scholar.google.com/scholar?cites=10178036880745109529&as_sdt=2005&sciodt=0,5&hl=en",83.0,2023-11-16 18:25:10,HTML,10.1007/s10586-020-03190-3,,,,,,,56.0,28.0,19.0,3.0,2.0,… a blockchain-based distributed access control system to maintain the IoT data privacy. In this … problems related to IoT data privacy as a result of its vulnerability to data leakage. Moreover…,https://link.springer.com/article/10.1007/s10586-020-03190-3,"https://scholar.google.com/scholar?q=related:GRijE56mP40J:scholar.google.com/&scioq=intitle:blockchain+intitle:data+intitle:privacy&hl=en&as_sdt=0,5",,,,,,,,,,,,,,,,,,,,,,,,,,,
1.0,"N Raghav, AK Bhola",Secured platform for healthcare data: privacy preservation based blockchain environment,2022.0,"Journal of Engineering, Design and …",emerald.com,https://www.emerald.com/insight/content/doi/10.1108/JEDT-09-2021-0494/full/html,"https://scholar.google.com/scholar?cites=6561044553201789470&as_sdt=2005&sciodt=0,5&hl=en",84.0,2023-11-16 18:25:10,,10.1108/JEDT-09-2021-0494,,,,,,,1.0,1.0,1.0,2.0,1.0,… blockchain-based safe health-care technology with privacy preservation tactics on preserving sensitive data… involved in the privacy preservation technique-based blockchain technology. …,,"https://scholar.google.com/scholar?q=related:HqoaXUKDDVsJ:scholar.google.com/&scioq=intitle:blockchain+intitle:data+intitle:privacy&hl=en&as_sdt=0,5",,,,,,,,,,,,,,,,,,,,,,,,,,,
7.0,"TW Jing, RK Murugesan",Protecting Data Privacy and Prevent Fake News and Deepfakes in Social Media via Blockchain Technology,2021.0,"… , ACeS 2020, Penang, Malaysia, December 8-9 …",Springer,https://link.springer.com/chapter/10.1007/978-981-33-6835-4_44,"https://scholar.google.com/scholar?cites=15962918628436685510&as_sdt=2005&sciodt=0,5&hl=en",85.0,2023-11-16 18:25:10,,10.1007/978-981-33-6835-4_44,,,,,,,7.0,3.5,4.0,2.0,2.0,"… To protect data integrity and privacy of the users on social media, this paper … data privacy in social media via blockchain technology. The proposed trust index model use blockchain to …",,"https://scholar.google.com/scholar?q=related:xjJv2uqth90J:scholar.google.com/&scioq=intitle:blockchain+intitle:data+intitle:privacy&hl=en&as_sdt=0,5",,,,,,,,,,,,,,,,,,,,,,,,,,,
1300.0,"X Yue, H Wang, D Jin, M Li, W Jiang",Healthcare data gateways: found healthcare intelligence on blockchain with novel privacy risk control,2016.0,Journal of medical systems,Springer,https://link.springer.com/article/10.1007/s10916-016-0574-6,"https://scholar.google.com/scholar?cites=18383530533497336246&as_sdt=2005&sciodt=0,5&hl=en",90.0,2023-11-16 18:25:10,,10.1007/s10916-016-0574-6,,,,,,,1300.0,185.71,260.0,5.0,7.0,"… Data Gateway (HGD)) architecture based on blockchain to enable patient to own, control and share their own data easily and securely without violating privacy, … patient data private. Our …",,"https://scholar.google.com/scholar?q=related:tvGnvp5rH_8J:scholar.google.com/&scioq=intitle:blockchain+intitle:data+intitle:privacy&hl=en&as_sdt=0,5",,,,,,,,,,,,,,,,,,,,,,,,,,,
6.0,"D Singh, JK Chaddah","A study on application of blockchain technology to control counterfeit drugs, enhance data privacy and improve distribution in online pharmacy",2021.0,Asia Pacific Journal of Health …,search.informit.org,https://search.informit.org/doi/abs/10.3316/INFORMIT.080973225524455,"https://scholar.google.com/scholar?cites=6332518874951352810&as_sdt=2005&sciodt=0,5&hl=en",92.0,2023-11-16 18:25:10,,10.3316/INFORMIT.080973225524455,,,,,,,6.0,3.0,3.0,2.0,2.0,… Blockchain technology is no exception in providing the solution to eliminate the counterfeit … Blockchain technology can ensure data privacy while improving supply chain transparency …,https://journal.achsm.org.au/index.php/achsm/article/download/1013/557,"https://scholar.google.com/scholar?q=related:6oHuml2g4VcJ:scholar.google.com/&scioq=intitle:blockchain+intitle:data+intitle:privacy&hl=en&as_sdt=0,5",,,,,,,,,,,,,,,,,,,,,,,,,,,
