Cites,Authors,Title,Year,Source,Publisher,ArticleURL,CitesURL,GSRank,QueryDate,Type,DOI,ISSN,CitationURL,Volume,Issue,StartPage,EndPage,ECC,CitesPerYear,CitesPerAuthor,AuthorCount,Age,Abstract,FullTextURL,RelatedURL
39,"K. Bhaskaran","Double-blind consent-driven data sharing on blockchain",2018,"Proceedings - 2018 IEEE International Conference on Cloud Engineering, IC2E 2018","","","https://www.scopus.com/inward/citedby.uri?partnerID=HzOxMe3b&scp=85048318723&origin=inward",4,"2022-06-21 18:20:00","Conference Paper","10.1109/IC2E.2018.00073","","https://api.elsevier.com/content/abstract/scopus_id/85048318723",,,385,391,39,9.75,39,1,4,"","",""
32,"Y. Zhu","Digital asset management with distributed permission over blockchain and attribute-based access control",2018,"Proceedings - 2018 IEEE International Conference on Services Computing, SCC 2018 - Part of the 2018 IEEE World Congress on Services","","","https://www.scopus.com/inward/citedby.uri?partnerID=HzOxMe3b&scp=85054030919&origin=inward",6,"2022-06-21 18:20:00","Conference Paper","10.1109/SCC.2018.00032","","https://api.elsevier.com/content/abstract/scopus_id/85054030919",,,193,200,32,8.00,32,1,4,"","",""
20,"K. Rantos","Blockchain-based consents management for personal data processing in the IoT ecosystem",2018,"ICETE 2018 - Proceedings of the 15th International Joint Conference on e-Business and Telecommunications","","","https://www.scopus.com/inward/citedby.uri?partnerID=HzOxMe3b&scp=85062961905&origin=inward",10,"2022-06-21 18:20:00","Conference Paper","10.5220/0006911005720577","","https://api.elsevier.com/content/abstract/scopus_id/85062961905",2,,572,577,20,5.00,20,1,4,"","",""
20,"M. Cash","Two-tier permission-ed and permission-less blockchain for secure data sharing",2018,"Proceedings - 3rd IEEE International Conference on Smart Cloud, SmartCloud 2018","","","https://www.scopus.com/inward/citedby.uri?partnerID=HzOxMe3b&scp=85057304276&origin=inward",12,"2022-06-21 18:20:00","Conference Paper","10.1109/SmartCloud.2018.00031","","https://api.elsevier.com/content/abstract/scopus_id/85057304276",,,138,144,20,5.00,20,1,4,"","",""
18,"M. Benchoufi","Blockchain protocols in clinical trials: Transparency and traceability of consent",2018,"F1000Research","","","https://www.scopus.com/inward/citedby.uri?partnerID=HzOxMe3b&scp=85084466753&origin=inward",13,"2022-06-21 18:20:00","Article","10.12688/f1000research.10531.5","2046-1402","https://api.elsevier.com/content/abstract/scopus_id/85084466753",6,,,,18,4.50,18,1,4,"","",""
14,"S. Gilda","Blockchain for Student Data Privacy and Consent",2018,"2018 International Conference on Computer Communication and Informatics, ICCCI 2018","","","https://www.scopus.com/inward/citedby.uri?partnerID=HzOxMe3b&scp=85053499107&origin=inward",15,"2022-06-21 18:20:00","Conference Paper","10.1109/ICCCI.2018.8441445","","https://api.elsevier.com/content/abstract/scopus_id/85053499107",,,,,14,3.50,14,1,4,"","",""
13,"C.S. Kouzinopoulos","Implementing a Forms of Consent Smart Contract on an IoT-based Blockchain to promote user trust",2018,"2018 IEEE (SMC) International Conference on Innovations in Intelligent Systems and Applications, INISTA 2018","","","https://www.scopus.com/inward/citedby.uri?partnerID=HzOxMe3b&scp=85055506013&origin=inward",16,"2022-06-21 18:20:00","Conference Paper","10.1109/INISTA.2018.8466268","","https://api.elsevier.com/content/abstract/scopus_id/85055506013",,,,,13,3.25,13,1,4,"","",""
3,"D. Hofman","Building Trust Protecting Privacy: Analyzing Evidentiary Quality in a Blockchain Proof-of-Concept for Health Research Data Consent Management",2018,"Proceedings - IEEE 2018 International Congress on Cybermatics: 2018 IEEE Conferences on Internet of Things, Green Computing and Communications, Cyber, Physical and Social Computing, Smart Data, Blockchain, Computer and Information Technology, iThings/GreenCom/CPSCom/SmartData/Blockchain/CIT 2018","","","https://www.scopus.com/inward/citedby.uri?partnerID=HzOxMe3b&scp=85061626573&origin=inward",31,"2022-06-21 18:20:00","Conference Paper","10.1109/Cybermatics_2018.2018.00275","","https://api.elsevier.com/content/abstract/scopus_id/85061626573",,,1650,1656,3,0.75,3,1,4,"","",""
73,"M. Benchoufi","Blockchain protocols in clinical trials: Transparency and traceability of consent",2017,"F1000Research","","","https://www.scopus.com/inward/citedby.uri?partnerID=HzOxMe3b&scp=85025107881&origin=inward",2,"2022-06-21 18:20:00","Article","10.12688/f1000research.10531.4","2046-1402","https://api.elsevier.com/content/abstract/scopus_id/85025107881",6,,,,73,14.60,73,1,5,"","",""
1097,"A. Azaria","MedRec: Using blockchain for medical data access and permission management",2016,"Proceedings - 2016 2nd International Conference on Open and Big Data, OBD 2016","","","https://www.scopus.com/inward/citedby.uri?partnerID=HzOxMe3b&scp=84991717011&origin=inward",1,"2022-06-21 18:20:00","Conference Paper","10.1109/OBD.2016.11","","https://api.elsevier.com/content/abstract/scopus_id/84991717011",,,25,30,1097,182.83,1097,1,6,"","",""
